Job Title,Job URN,Company Name,Location,Applicants,Seniority,Employment type,Job function,Industries,Job description,Posted on,Skills
Java Developer (Exchange/ Trading Platform),3677547309,Crypto.com,"Singapore, Singapore (Hybrid)",151,Entry level,Full-time,Engineering:Information Technology,Financial Services,"The exchange team develops and maintain a cutting-edge trading platform. With a global presence across APAC, EMEA and North America, the team has since grown with the goal to provide a seamless and secure trading experience for our clients.
Responsibilities
Design and implement products and solutions for our exchange trading platform in a number of micro-service based componentsPerformance Optimization - continuously optimize the platform's performance and latency to handle high-frequency trading volumes and reduce response times. Handle real-time market data feeds and design efficient data processing mechanisms to ensure timely and accurate updates on trading instruments.Work closely with quantitative analysts and traders to implement algorithmic trading strategies, optimize execution algorithms, and enhance order management systems.Work closely with product management team to continuously optimistic existing or developer new models/products/algorithms Implement new features and functionality while maintaining code integrity and quality.Code Review and Quality Assurance - conduct code reviews and participate in quality assurance and audit processes to maintain code standards, identify bugs, and address security and potential issues proactively.Stay up-to-date with the latest advancements in Java development, financial technologies, and trading systems. Propose and implement innovative solutions to improve the platform's efficiency and functionality.
Requirements
5+ years experience on programming in java - Preferably experience at an Investment Bank, Hedge Fund or Exchange developing trading applications in Equity, FX or Derivative products in traditional or crypto market Adapt and understand TDD methodology, experience on doing automated testing Strong desire for do things better, attention to detail and hold strong responsibility to his/her tasks Open to challenges and eager to learn Able to work under pressure, fast learner and able to adapt changing priorities within a fast moving industry Derivative product experience is a plus Python knowledge is a plus 
Life @ Crypto.com
Empowered to think big. Try new opportunities while working with a talented, ambitious and supportive team.
Transformational and proactive working environment. Empower employees to find thoughtful and innovative solutions.
Growth from within. We help to develop new skill-sets that would impact the shaping of your personal and professional growth.
Work Culture. Our colleagues are some of the best in the industry; we are all here to help and support one another.
One cohesive team. Engage stakeholders to achieve our ultimate goal - Cryptocurrency in every wallet.
Work Flexibility Adoption. Flexi-work hour and hybrid or remote set-up
Aspire career alternatives through us - our internal mobility program offers employees a new scope.
Work Perks: crypto.com visa card provided upon joining
Are you ready to kickstart your future with us?
Benefits
Competitive salary
Attractive annual leave entitlement including: birthday, work anniversary
Work Flexibility Adoption. Flexi-work hour and hybrid or remote set-up
Aspire career alternatives through us. Our internal mobility program can offer employees a diverse scope.
Work Perks: crypto.com visa card provided upon joining
Our Crypto.com benefits packages vary depending on region requirements, you can learn more from our talent acquisition team.
About Crypto.com :
Founded in 2016, Crypto.com serves more than 80 million customers and is the world's fastest growing global cryptocurrency platform. Our vision is simple: Cryptocurrency in Every Wallet™. Built on a foundation of security, privacy, and compliance, Crypto.com is committed to accelerating the adoption of cryptocurrency through innovation and empowering the next generation of builders, creators, and entrepreneurs to develop a fairer and more equitable digital ecosystem.
Learn more at https://crypto.com .
Crypto.com is an equal opportunities employer and we are committed to creating an environment where opportunities are presented to everyone in a fair and transparent way. Crypto.com values diversity and inclusion, seeking candidates with a variety of backgrounds, perspectives, and skills that complement and strengthen our team.
Personal data provided by applicants will be used for recruitment purposes only.
Please note that only shortlisted candidates will be contacted.",21-Sep-2023,Code Review:High-Frequency Trading:Java:Performance Tuning:Test-Driven Development
Java Software Developer (Singaporeans Only),3725797953,Avensys Consulting,"Singapore, Singapore (On-site)",47,Mid-Senior level,Full-time,Information Technology,IT Services and IT Consulting,"Avensys is a reputed global IT professional services company headquartered in Singapore. Our service spectrum includes enterprise solution consulting, business intelligence, business process automation and managed services. Given our decade of success we have evolved to become one of the top trusted providers in Singapore and service a client base across banking and financial services, insurance, information technology, healthcare, retail and supply chain.
We are currently looking to hire Java Application Developer. This is an exciting opportunity to expand your skill set, achieve job satisfaction and work-life balance. More details as below.
Job Scope:Support continuous improvement throughout the development life cycle of enterprise level software solutions. This includes enhancing / maintaining of software applications.Perform system integration testing and troubleshooting of software application issues.Conducts unit testing using unit test frameworks.Create and maintain documentation for software design specifications.
Requirements:Candidate must possess at least a Diploma/Degree in Computing/Information Technology or related fieldPossess good analytical, problem-solving skillsShould have at least 2-7+ years of development experience in JavaExperience in Spring/Spring Boot frameworkExperience in relational databases such as Oracle and MySQLExperience in implementing web services such as SOAP and RESTful web servicesExperience in frontend frameworks such as Angular, Struts, jQuery and BootstrapAble to adapt to a fast-paced work environmentAbility to learn new technologies quicklyGood verbal and written communication skillsGood understanding of modern software development methodologiesGood understanding of software testing methodologies, scripting and toolsExperience in one or more full SDLC for enterprise projectsAbility to work effectively independently as well as in a team

WHAT’S ON OFFER:You will be remunerated with an excellent base salary and entitled to attractive company benefits. Additionally, you will get the opportunity to enjoy a fun and collaborative work environment, alongside a strong career progressionTo submit your application, please apply online or email your UPDATED CV in Microsoft Word format to anamika@aven-sys.com Your interest will be treated with strict confidentiality.

CONSULTANT DETAILS:Consultant Name : Anamika MukerjiAvensys Consulting Pte LtdEA Licence 12C5759
Privacy Statement: Data collected will be used for recruitment purposes only. Personal data provided will be used strictly in accordance with the relevant data protection law and Avensys' privacy policy.",22-Sep-2023,.NET Framework:Business Intelligence (BI):Data Protection Law:English:Java:JavaScript:SQL:Skill Development:Software Development:Spring Boot:Spring Framework
Full-Stack Software Developer,3712124085,SGInnovate,"Singapore, Singapore (Hybrid)",182,Associate,Full-time,Information Technology:Engineering,"Technology, Information and Internet:IT Services and IT Consulting:Software Development","This role is with Wittaya Aqua, a startup supported by SGInnovate. About Wittaya Aqua From complexity to simplicity. We see a world where every member of the aquaculture industry, no matter how big or small, flourishes. Wittaya Aqua is a Toronto and Singapore-based, award-winning and venture-backed organization with a mission to help aquaculture operations be more profitable, sustainable, and environmentally friendly. Our core values are collaboration, data-driven decision-making, thoughtfulness, and empowerment. We are looking for a team-oriented self-starter who takes ownership over solving complex problems, applies creative solutions and delivers elegant end-products in a full-stack environment. You should be excited about building innovative products that are helping feed the world and improve the sustainability of aquaculture, while working with some of the leading experts in aquaculture, nutrition and advanced analytics in aquaculture.
Responsibilities:The role includes, but is not limited to, the following responsibilities:
Building on top of our current web app ecosystem consisting of VueJS in the frontend, NodeJS and Express in the backend, and PostgreSQL for our databaseDelivering well-designed, maintainable solutions with our development team in a Lean / Agile environmentCollaborating with our developers and product manager with effective and clear communicationProducing well-tested code/features. We value developers who consistently QA their own code before every pull requestDeveloping within our full stack environment, you will be given the opportunity to choose between developing our frontend interfaces, Backend APIs, Database architectures, DevOps environments, or all the aboveWorking closely with the product and Science team to understand business and product requirementsParticipating in sprint planning, backlog grooming, and other agile development activities to ensure quarterly goals are consistently met
Requirements:3+ years of full-stack development ideally in SaaS, Enterprise or AgTech sectorsEngineering, or other-related university degrees/qualificationsFamiliarity with agile development methodologies such as Scrum or Kanban, and experience working in an Agile environmentExperience with cloud technologies such as Digitalocean (or AWS). Ability to deploy and manage web applications in the cloudA portfolio of previous work or great references for recent projectsExtensive knowledge in our full stack environment, Devops experience, QA experience, architecting experienceJavaScript experienceThree or more of: Vue.js (or React), Vuetify, Node.js, Express, HTML5, Docker, PostgreSQL, Mocha (Cypress, Jest),Knowledge or experience with SQLProficient with Git, and CloudExperience in the food agriculture and tech agriculture industry is not required but is considered an assetAbility to collaborate with a team to solve creative challenges and present workable options
Who you are:You are a leader through your actions and you lead with the company's valuesYou are reliable and dependable. You do what you say you’re going to do and let your team know as far in advance as possible if deadlines or deliverables are at riskYou are humble and recognize that no one has all the answers. You actively seek out answers to questions you don’t have answers to and are naturally curiousYou actively promote a positive and healthy environment for developersYou like being taught and coached new things and you also like teaching and coaching others on what you’ve learnedYou have excellent time management skills and are able to prioritize tasks effectively to meet project deadlines.You balance thoughtfulness and expediency. You don’t do anything without thinking it through, but you also know when it’s time to move from thinking to doingYou are detail-oriented and take pride in delivering quality workYou care about the planet, where and how food is produced and want to be a part of making aquaculture better for big companies and smallholders alike
Interested candidates may apply directly on STARS Marketplace at:https://stars.sginnovate.com/viewrole?type=tm&jobid=MKT_2023_WIT233005_2166",13-Sep-2023,Amazon Web Services (AWS):Cloud Computing:DigitalOcean:Git:JavaScript:Node.js:PostgreSQL:SQL:Software Development:Vue.js
Software Applications Developer (.Net),3723375277,PetroChina International (Singapore),"Singapore, Singapore (On-site)",339,Associate,Full-time,Information Technology:Project Management,Oil and Gas,"ResponsibilitiesDesign, build, and maintain efficient, reusable, and reliable .NET code based on Azure DevOps.Collaborate with internal teams to produce software design and architecture.Identify bottlenecks and bugs, and devise solutions to address and mitigate these problems.Participate in requirements analysis with users and business analysts.Revise, update, refactor and debug code.Perform knowledge sharing with peers, ensuring the team adheres to best practices and code quality.Develop documentation throughout the software development life cycle (SDLC).Test and deploy applications and systems.Serve as an expert on applications and provide technical support when necessary.Management of vendors to ensure the operating support model of the related IT services are in-placed and fulfilled the agreed SLA metrics.
RequirementsDegree in Computer Science or Information Technology or related studies.At least 3 years of software and application development & support experience as a developer and s/w designer with substantial know-how and hands-on experience in areas of work such as (but not limited to): -i. Software Application programming using .NET languages (C#) with knowledge of SQL and working with databases, API and other systems interfaces in the implementation of web, desktop or mobile applications.ii. Strong understanding of object-oriented programming, test automation and functional testingiii. Hands-on experience in Web, Mobile and API based testingiv. Experience on Azure DevOps and CICD.v. Experience in Project Management Life Cycle.vi. Proficient in Microsoft stack (C#, .NET Core, SQL, Web API)

Please write in with a full resume, present and expected salary, contact telephone number(s) and any other relevant information to:
Email: hr@petrochina.com.sg
We regret to inform that only shortlisted candidates will be notified.
Personal Data ProtectionIn submitting your personal data and/or resume, you shall be deemed to consent to us collecting, using and disclosing your personal data for the purpose of assessing your job application. Information collected may also be disclosed to the PetroChina Group of Companies (which includes PetroChina International (Singapore) Pte. Ltd., Singapore Petroleum Company Limited) for this purpose.",26-Sep-2023,.NET Core:.NET Framework:Azure DevOps Services:C#:Computer Science:Continuous Integration and Continuous Delivery (CI/CD):Microsoft Azure:Object-Oriented Programming (OOP):Project Management:SQL:Software Development
Application Developer,3725532723,Nicoll Curtin,"Singapore, Singapore (On-site)",30,Mid-Senior level,Contract,Engineering:Information Technology,IT Services and IT Consulting,"Job Summary:Deep knowledge of SAP Hana, BODS, BOBJ, BOIS. Knowledge of OS like Linux, Windows. Scripting proficiency. This role also requires knowledge of networking, Database, SQL. Day to day activity involves resolving operations tickets,, server monitoring, attend client meetings etc.
Responsibilities:1; Overall, 6-8 years in IT working in large scale application outsourcing / support engagements 2: Manage application jobs, and provide instructions to Level 1 Application Operations team for jobs recovery/execution 3:Escalate incident and event tickets to Level 3 teams within defined SLA in compliance to client s incident management process 4:Perform and manage incident and event tickets, determine priority and resolution from Level 1 escalation within defined SLA compliance to Client Technical Experience 1: Proficiency with IBM Integration Bus, WebSphere MQ Series, IBM WebSphere MQ , generating message sets with COBOL Copybooks and WSDL files, Message flows with XSLT, SOAP messaging concepts, File operations with file nodes, JMS concepts, SOA and SOA concepts, MQ Clustering 2: MQ Destination Lists, MQ Broker as an Enterprise Service Bus ESB, Design Patterns, and the application of Design Patterns using message flows such as Request-Reply, Composite message flows, Publish/Subscribe Professional Attributes Good analytical skills and good communication skills
If you're keen, please apply via this job ad or drop an email to kanatip.kantiwong@nicollcurtin.com
Role is on 12 month contract basis.
Only Candidates based in Singapore can be considered for this role",27-Sep-2023,Application Development:COBOL:Design Patterns:Enterprise Service Bus (ESB) Architecture:Linux:Message Queue:SAP ERP:SAP FICO:SAP Products:SOAP:Web Services Description Language (WSDL):XSLT
Software Developer (Layer 7),3729433480,Accenture Southeast Asia,"Singapore, Singapore",6,Mid-Senior level,Full-time,Information Technology:Engineering,Business Consulting and Services,"About Accenture
Accenture is a global professional services company with leading capabilities in digital, cloud and security. Combining unmatched experience and specialized skills across more than 40 industries, we offer Strategy and Consulting, Interactive, Technology and Operations services—all powered by the world’s largest network of Advanced Technology and Intelligent Operations centres. Our 506,000 people deliver on the promise of technology and human ingenuity every day, serving clients in more than 120 countries. We embrace the power of change to create value and shared success for our clients, people, shareholders, partners and communities. Visit us at www.accenture.com.
Accenture is an Irish-domiciled multinational professional services company that provides services in:

 Technology

 Strategy & Consulting

 Interactive

 Operations

As a Fortune Global 500 company, it has been incorporated in Dublin, Ireland since September 1, 2009.
With more than 500,000 employees worldwide—in 200 cities across 51 countries—Accenture also operates more than 100 “innovation hubs,” developing solutions for cloud, finance, and other industries.
The Pillar 
Accenture Technology combines business and industry insights with innovative technology services to transform your business. Join one of the world’s largest independent providers of technology services to grow your expertise and help clients worldwide to innovate at scale and transform their businesses. Help change how the world works and lives through technology innovation.
The Group
Accenture Cloud First is a new multi-service group of 70,000 cloud professionals that brings together the full power and breadth of Accenture’s industry and technology capabilities, ecosystem partnerships, and deep commitment to learning and upskilling clients’ employees and to responsible business, with the singular focus of enabling organizations to move to the cloud with greater speed and achieve greater value for all their stakeholders at this critical time. Specifically, this new group integrates the company’s wide-ranging cloud expertise, including:

Software Development, Cloud migration, infrastructure, and application services and ecosystem partnerships; deep industry and cross-industry insights, data, and Applied Intelligence capabilities.

Responsibilities include but are not limited to:

Coordinates with the Build Team in understanding client requirements and how they translate in application features

Collaborate with the Team to set specifications for new applications

Perform troubleshooting and debugging of applications if needed

Evaluate existing applications to reprogram, update and add new features

Work with business process owners/SMEs to assess capabilities and identify high-level user requirements and Work with project managers, architects, and SMEs to define metrics and performance goals for the process.

Participate in transitioning the requirements and use cases to the designers to ensure a clear and complete understanding of the requirements.

Be nice, respectful, able to work in a team

A Good team player is a must

Critical Success Factors
Mandatory

Has a work experience with Layer 7

Has a work experience with Java / J2EE

Good to have skills:

Build Forge / Scheduling application

All our consulting professionals receive comprehensive training covering business acumen, technical and professional skills development. You’ll also have opportunities to hone your functional skills and expertise in an area of specialization. We offer a variety of formal and informal training programs at every level to help you acquire and build specialized skills faster. Learning takes place both on the job and through formal training conducted online, in the classroom, or in collaboration with teammates. The sheer variety of work we do, and the experience it offers, provide an unbeatable platform from which to build a career.
Accenture is an equal opportunities employer and welcomes applications from all sections of society and does not discriminate on grounds of race, religion, or belief, ethnic or national origin, disability, age, citizenship, marital, domestic, or civil partnership status, sexual orientation, gender identity, or any other basis as protected by applicable law.
",28-Sep-2023,Build Forge:Business Process:Client Requirements:Debugging:Defining Requirements:Jakarta EE:Java:Software Development:Troubleshooting:User Requirements
