Job Title,Job URN,Company Name,Location,Applicants,Seniority,Employment type,Job function,Industries,Job description,Posted on,Skills
Android Mobile Developer (Financial Services) | Contract l $8K,3725827136,Manpower Singapore,Singapore,18,Entry level,Contract,Engineering:Information Technology,Staffing and Recruiting,"Key Responsibilities
Collaborate with cross-functional teams, including designers, product owners, QA, and engineers, to develop and enhance Android applications.Utilize modern software development methodologies popular in Android to architect, code, and deliver high-quality features.Work in a fast-paced, small-team environment within the stability of a Fortune 100 company.Write, delete, and refactor code to improve application performance, user experience, and codebase quality.Implement continuous integration patterns using tools like Gradle, GitHub Actions, and Circle CI.Debug, find, and fix bugs, and employ asynchronous coding patterns.Optimize application performance through performance analysis and code optimization.Collaborate with legacy code and design solutions for complex, open-ended problems.Develop unit and integration tests to ensure code reliability.Participate in open-source initiatives and contribute to the broader engineering community.Integrate Android applications with backend services and APIs.Demonstrate self-starting abilities and effective time management skills.
Qualifications
Bachelor's degree in Computer Science or any related field.Minimum 4 years of experience in building Android applications.Experience with build tools such as Gradle, GitHub Actions, and Circle CI.Knowledge of continuous integration patterns.Familiarity with asynchronous coding patterns.Prior experience with performance analysis and optimization.Experience developing unit and integration tests.Knowledge of Android technologies including Compose, MVI Architecture, REST APIs, OkHttp, Dagger, Kotlin, Coroutines, Flow, RxJava, Espresso, JUnit, and more.Experience with RAML API documentation and Test Fakes.Integration expertise with bespoke backend services.
Interested Applicants, please email your resume to rupa.kankariya@manpower.com.sg (R1441955), stating the position as the subject title in the email. All Applications will be handled with strict confidentiality.
Rupa Kankariya EA License No. 02C3423 Personnel Registration No. R1441955
Please note that your response to this advertisement and communications with us pursuant to this advertisement will constitute informed consent to the collection, use and/or disclosure of personal data by ManpowerGroup Singapore for the purpose of carrying out its business, in compliance with the relevant provisions of the Personal Data Protection Act 2012. To learn more about ManpowerGroup's Global Privacy Policy, please visit https://www.manpower.com.sg/privacy-policy",22-Sep-2023,API Documentation:Android:Build Tools
DevOps Automation Developer,3714462572,Temus,"Singapore, Singapore (On-site)",172,Mid-Senior level,Full-time,Information Technology,Business Consulting and Services:Computer and Network Security:IT Services and IT Consulting,"The creation of Temus was catalysed by the need for sophisticated digital capabilities to drive transformation across the public and private sector, in Singapore and broader region.Our approach seeks to drive transformation ""holistically"", which looks beyond the use of technology and covers all aspects of people, process, change management and policy, which is critical to driving successful transformation outcomes.Everything we do is geared towards helping transform people's lives through technology.We seek to achieve simplicity in everything we do, in the way people embrace technology, the way we serve our clients and the way we run internally.We offer end-to-end transformation that starts with a design for value orientation and ""walks"" the path with strong IT service and delivery capabilities, centered in Singapore.We are committed to offering a strong talent value proposition, where we stand for purposeful and impactful work, and at the centre of Singapore's technology ecosystem.
Position Summary / Job DescriptionAs an DevOps Automation Developer, you will play a pivotal role in our operations by developing internal tools for software development and automating critical processes. Your responsibilities will encompass creating, testing, and delivering automation scripts in alignment with defined operational requirements.
Role and ResponsibilitiesDevelop, rigorously test, and implement automation scripts to streamline various operational tasks.Analyze and promptly troubleshoot any issues that arise during script execution.Accurately document functional and programming specifications within project scopes.Identify opportunities for process enhancements, focusing on system scalability and reliability.Collaborate in DevOps processes to automate application deployments and post-deployment/maintenance verification.
Requirements / Qualifications Bachelor’s degree in computer science or a closely related highly technical or scientific discipline.Minimum of 3 years of experience in application development and support.Strong knowledge and understanding of the IT industry environment and business needs.Proven track record in developing web, mobile, or client-based applications.Cross-platform experience with the ability to identify and resolve integration issues.Solid background in quality assurance practices.Understanding of CI/CD (Continuous Integration/Continuous Deployment) principles.Exceptional teamwork skills, with the ability to collaborate effectively within a team.Proficiency in Ansible or Katalon is a mandatory requirement.Experience with Linux and UFT is preferred but not mandatory.
(By applying for this role, you have read and acknowledge the data privacy statement via this link - Https://www.temus.com/policy/)",26-Sep-2023,Ansible:Automation:Continuous Delivery (CD):Continuous Integration (CI):Continuous Integration and Continuous Delivery (CI/CD):HP QuickTest Professional (QTP):Katalon Studio:Linux:Skill Development:Teamwork
Application Developer (SQL)_Singapore,3705851992,Luxoft,"Singapore, Singapore",245,Mid-Senior level,Full-time,Information Technology:Analyst,IT Services and IT Consulting:Motor Vehicle Manufacturing,"Project Description:You will perform an Application Developer role for facilitating IT related Regulatory projects within the Finance domain for our banking client , overseas subsidiaries and branches.Responsibilities:• To enhance and develop projects/Change Requests related changes and to ensure deliverables are in good quality• To develop functionalities to cater for business requirements using Unix/PLSQL• To design and build the Control-M jobs for batch processing• To carry out unit testing and SIT on the developed functions• To support UAT cycle, troubleshoot the issues and provide bug fixes• To raise remedy ticket for required changes in controlled environments• To migrate deliverables objects using Aldon migration tools to UAT/Production environment• To provide proper documentation for all the deliverables• To ensure the design & build is in line with the standard and all deviations are clearly articulated and agreed. The scope should be from sourcing from upstream till the final report generation• Review the code to ensure it does not break / Lead to performance issue• Prepare necessary documents to facilitate and deliver the project (Release checklist, UAT results, etc.)Mandatory Skills Description:The candidate must have 4-6 years working experience in the following areas:• Good understanding in SDLC phases• Working experience of CRS reporting• Capability in requirement analysis and functional design skills• Capability of self-learning and a quick learner• Be adaptable, flexible and be able to thrive in a challenging, fast-paced of a growing organization / environment• Experience with project management best practices/ methodologies/ project lifecycle• Developer experience in SQL Server. Strong knowledge on MS SQL developer and should be able to write sql queries• Good knowledge of SQL database• Proficient with Batch & Power Shell scripting• Good understanding in Data Warehouse and Data Mart concept• Experience in Performance tuning of queries• Good knowledge on SSIS & SSRS - ETL transformation & Reporting purposes",04-Sep-2023,Data Warehousing:Linux:Microsoft SQL Server:PL/SQL:Powershell:Requirements Analysis:SQL:SQL Server Integration Services (SSIS):SQL Server Reporting Services (SSRS):Software Development Life Cycle (SDLC):Unit Testing:User Acceptance Testing
Internship - Full Stack Developer/DevSecOps Engineers (2024 Intake),3699230252,IBM,"Singapore, Singapore (On-site)",337,,Full-time,Information Technology,Computer Hardware Manufacturing,"655669BR
Introduction
At IBM, work is more than a job - it's a calling: To build. To design. To code. To consult. To think along with clients and sell. To make markets. To invent. To collaborate. Not just to do something better, but to attempt things you've never thought possible. Are you ready to lead in this new era of technology and solve some of the world's most challenging problems? If so, lets talk.
Your Role and Responsibilities
Overview
IBM is a global cognitive and cloud company changing the way the world works. We foster a culture of creative, innovative thinkers; people who are curious about how technology can transform busine
Undergoing studies in Computing Science or related course of studiesDemonstrated programming proficiency and experience with 1 of the following (Java, C++, Python, SQL, Hadoop, HTML, Spring Boot, Tableau, Angular, React), as well as systems design/development, and information technology course work Exposure to web services, microservices, API, DevSecOps and multiple Java application frameworks highly desiredFamiliarity with Hyperscalers (e.g. AWS, Azure, Google, IBM Cloud) and cloud native technologiesAbility to translate business requirements into technical solutions Ability to thrive in an ever changing, technology based consulting environment, using agile development techniques 

sses and impact the world. Our consultants are part of IBM Services where we engage with clients across every industry to deliver technology-driven solutions. We cultivate a diverse, inclusive, global team of people who want to pioneer, reimagine and disrupt the future. We’re driven to stay ahead in the marketplace and enhance our relevance to be essential to our clients, and this begins with our talent.
Here’s where you come in. We’re looking for passionate, original thinkers who want to drive progress, grow their network and further their careers. If you see yourself as someone who never stops learning and is dedicated to staying ahead and being essential for clients, who believes no problem is too big to solve, and who wants to unleash your potential, IBM Services is for you.
As an intern, you’ll be a part of client-facing teams as a consultant, developer, designer, data scientist, or technical specialist to help businesses change the way they work.
Our clients' technical and business needs are constantly evolving. We’re hiring inspired, talented individuals eager to apply their knowledge and perspective to challenging work that evolves industries and our world. We prioritize ongoing learning, development of technical skills, and continuous personal growth, all grounded in a culture of coaching and apprenticeship.
Your Role And Responsibilities
We’re looking for a real-world problem solver with the technical savvy to make the impossible, possible. As an intern, you’ll help design, develop, and integrate solutions using future-looking technologies, techniques, and products our clients demand today. You’ll work with clients, finding solutions to major challenges by translating system requirements into the design and development of customized systems in an agile environment.
Work You Could Do
Define, detail and scope the technical requirements into solution architecture and drive an independent project from an architectural stand point. Design, develop and/or re-engineer application components, and integrate software packages, programs, and reusable objects residing on multiple platforms. Support Technical Consultants and lead in building solutions and providing technical mentoring and guidance 
Required Technical and Professional Expertise
Undergoing studies in Computing Science or related course of studiesDemonstrated programming proficiency and experience with 1 of the following (Java, C++, Python, SQL, Hadoop, HTML, Spring Boot, Tableau, Angular, React), as well as systems design/development, and information technology course work Exposure to web services, microservices, API, DevSecOps and multiple Java application frameworks highly desiredFamiliarity with Hyperscalers (e.g. AWS, Azure, Google, IBM Cloud) and cloud native technologiesAbility to translate business requirements into technical solutions Ability to thrive in an ever changing, technology based consulting environment, using agile development techniques 
Preferred Technical And Professional Expertise
Please refer to JD above.
About Business Unit
IBM Consulting is IBM’s consulting and global professional services business, with market leading capabilities in business and technology transformation. With deep expertise in many industries, we offer strategy, experience, technology, and operations services to many of the most innovative and valuable companies in the world. Our people are focused on accelerating our clients’ businesses through the power of collaboration. We believe in the power of technology responsibly used to help people, partners and the planet.
Your Life @ IBM
In a world where technology never stands still, we understand that, dedication to our clients success, innovation that matters, and trust and personal responsibility in all our relationships, lives in what we do as IBMers as we strive to be the catalyst that makes the world work better.
Being an IBMer means you’ll be able to learn and develop yourself and your career, you’ll be encouraged to be courageous and experiment everyday, all whilst having continuous trust and support in an environment where everyone can thrive whatever their personal or professional background.
Our IBMers are growth minded, always staying curious, open to feedback and learning new information and skills to constantly transform themselves and our company. They are trusted to provide on-going feedback to help other IBMers grow, as well as collaborate with colleagues keeping in mind a team focused approach to include different perspectives to drive exceptional outcomes for our customers. The courage our IBMers have to make critical decisions everyday is essential to IBM becoming the catalyst for progress, always embracing challenges with resources they have to hand, a can-do attitude and always striving for an outcome focused approach within everything that they do.
Are you ready to be an IBMer?
About IBM
IBM’s greatest invention is the IBMer. We believe that through the application of intelligence, reason and science, we can improve business, society and the human condition, bringing the power of an open hybrid cloud and AI strategy to life for our clients and partners around the world.Restlessly reinventing since 1911, we are not only one of the largest corporate organizations in the world, we’re also one of the biggest technology and consulting employers, with many of the Fortune 50 companies relying on the IBM Cloud to run their business. At IBM, we pride ourselves on being an early adopter of artificial intelligence, quantum computing and blockchain. Now it’s time for you to join us on our journey to being a responsible technology innovator and a force for good in the world.
Location Statement
For additional information about location requirements, please discuss with the recruiter following submission of your application.
Being You @ IBM
IBM is committed to creating a diverse environment and is proud to be an equal opportunity employer. All qualified applicants will receive consideration for employment without regard to race, color, religion, gender, gender identity or expression, sexual orientation, national origin, genetics, pregnancy, disability, age, veteran status, or other characteristics. IBM is also committed to compliance with all fair employment practices regarding citizenship and immigration status.",19-Sep-2023,Agile Environment:Business Requirements:Data Architecture:Defining Requirements:HTML:Hadoop:React.js:Spring Boot:Systems Design:Technical Requirements
Full Stack Java Developer,3723300850,Quadrant Resource,"Singapore, Singapore (On-site)",97,Mid-Senior level,Full-time,Other,IT Services and IT Consulting,"• Troubleshoot and provide resolution to the bug raised by users. • Responsible for design, development, integration, testing and deployment of system application.• Develop product engineering mind-set.• Experience integrating with other backend systems. • Prepare any technical design document. • The developer is flexible to be assigned for other tasks such as integration and reporting. • Have a keen eye for identifying improvement opportunities, and the skill to get buy-in and ensure implementation  We would like you to have at least: • 5+ years of experience with Java development and design. • Have programming experience with Java SDK1.8, OpenCMS 10.5.0 and above, Ecquaria SOP 6.1 and above, Microsoft SQL 2016.• Plus to have experience with .NET, ASP.NET, .NET Core, ReactJS, AngularJS, SQL Reporting• Have experience with Azure DevOps is a benefit.",25-Sep-2023,.NET Framework:Full-Stack Development:Java:Microsoft Azure
Frontend Developer (NX Monorepo_Angular_JEST_KARMA_Protractor_CYPRESS),3715481633,Maltem Asia-Pacific,"Singapore, Singapore (On-site)",46,Mid-Senior level,Full-time,Information Technology,IT Services and IT Consulting,"Maltem Singapore is seeking a Frontend Developer for our Wealth Management Client.
Summary:In this role, you will be involved in creating modular and reusable components that can be utilized across the ISPVM Digital Ecosystem applications. The goal is to develop a set of components that can be easily integrated into various applications, improving efficiency and reducing development time.

Key Requirements :Strong understanding of NX Monorepo and experience with building and maintaining large scale Angular applications using NX.Knowledge of micro Frontend architecture and experience with building and maintaining micro Frontend applications.Experience with Frontend Testing frameworks such as Jest, Karma, or Protractor.",13-Sep-2023,Cascading Style Sheets (CSS):JavaScript:Node.js:PostCSS:Python (Programming Language):React.js:Redux.js:SASS:Stylus:TypeScript
Backend Golang Developer,3690746661,Trust Wallet,Singapore (Remote),239,Mid-Senior level,Full-time,Information Technology,Software Development,"Company Description
Trust Wallet is the world’s most inclusive, chain-agnostic, self-custody wallet that serves tens of millions users globally. Trust Wallet provides a secure, seamless and intuitive gateway to the crypto and NFT ecosystems. Our users are able to send, receive, stake, mint and store across 4.5+ million cryptocurrencies on 66+ blockchains, including Bitcoin, Ethereum, BSC, Polygon, Solana, Avalanche, etc. Our developer community of different projects relies on us to reach millions of their users, build their own wallets, and grow crypto adoption.
If you’re passionate and motivated by building cloud-based microservices and highly scalable APIs, we invite you to join us to build innovative crypto architectures and advance technologies that will accelerate the delivery of web3 innovations to our users.
Job Description
System design: You will be able to think about how the services are built, communicate with each other and with third partiesFeature development and optimization: You will be owning backend features that support all our platforms (extension, mobile, and desktop)Infrastructure: You will help to define how Trust Wallet runs and deploys backend services to our millions of usersTeam building: You will be working with the team to create and foster a culture of raising the bar with each new hireInterfacing with users: You will be interfacing directly with end-users and developers building on Trust Wallet – supporting them and collecting feedback to inform the direction of the product
Qualifications
4+ years of software engineering experience, including extensive knowledge of Go (2+ years for Mid Level role)Experience building microservice-based architecturesStrong technical problem solving, communication, and collaboration skillsExperience with cloud environments like AWS, Azure, or GCPDeep knowledge of Key Value, SQL databasesExperience with containerization (e.g. Docker, Kubernetes)
Nice to have:
Experience in a blockchain-based projectExperience building distributed systems. Expertise in identifying and analyzing performance bottlenecksExpertise in NoSQL and/or other database storage enginesExperience building distributed systems. 
Additional Information
Why work at Trust Wallet?
Be a part of the world’s leading blockchain ecosystem that continues to grow and offers excellent career development opportunities. Work alongside diverse, world-class talent, in an environment where learning and growth opportunities are endless. Tackle fast-paced, challenging and unique projects. Work in a truly global organization, with international teams and a flat organizational structure. Enjoy competitive salary and benefits. Balance life and work with flexible working hours and casual work attire. 
Apply today to join our team in building the world’s most trusted and secure crypto wallet and enable a decentralized future for everyone.
Trust Wallet is committed to being an equal opportunity employer. We believe that having a diverse workforce is fundamental to our success.
By submitting a job application, you confirm that you have read and agree to our Candidate Privacy Notice.",30-Sep-2023,Cryptocurrency:Figma (Software):FinTech:Payments:Product Road Mapping:UX Research:User Experience (UX):User Personas:User-centered Design
Mobile Developer (Android) | Contract | Financial Services,3725255781,Manpower Singapore,Singapore,2,Entry level,Contract,Engineering:Information Technology,Staffing and Recruiting,"Key Responsibilities
Collaborate with cross-functional teams, including designers, product owners, QA, and engineers, to develop and enhance Android applications.Utilize modern software development methodologies popular in Android to architect, code, and deliver high-quality features.Work in a fast-paced, small-team environment within the stability of a Fortune 100 company.Write, delete, and refactor code to improve application performance, user experience, and codebase quality.Implement continuous integration patterns using tools like Gradle, GitHub Actions, and Circle CI.Debug, find, and fix bugs, and employ asynchronous coding patterns.Optimize application performance through performance analysis and code optimization.Collaborate with legacy code and design solutions for complex, open-ended problems.Develop unit and integration tests to ensure code reliability.Participate in open-source initiatives and contribute to the broader engineering community.Integrate Android applications with backend services and APIs.Demonstrate self-starting abilities and effective time management skills.
Qualifications
Bachelor's degree in Computer Science or any related field.Minimum 4 years of experience in building Android applications.Experience with build tools such as Gradle, GitHub Actions, and Circle CI.Knowledge of continuous integration patterns.Familiarity with asynchronous coding patterns.Prior experience with performance analysis and optimization.Experience developing unit and integration tests.Knowledge of Android technologies including Compose, MVI Architecture, REST APIs, OkHttp, Dagger, Kotlin, Coroutines, Flow, RxJava, Espresso, JUnit, and more.Experience with RAML API documentation and Test Fakes.Integration expertise with bespoke backend services.
Interested candidates may send in their resume and cover letter directly to gem.cabria@manpower.com.sg (R1434374), stating the position as the subject title in the email.
Jireli Gem Mejia Cabria EA License No.: 02C3423 Personnel Registration No.: R1434374
Please note that your response to this advertisement and communications with us pursuant to this advertisement will constitute informed consent to the collection, use and/or disclosure of personal data by ManpowerGroup Singapore for the purpose of carrying out its business, in compliance with the relevant provisions of the Personal Data Protection Act 2012. To learn more about ManpowerGroup's Global Privacy Policy, please visit https://www.manpower.com.sg/privacy-policy",21-Sep-2023,Android:Building Performance
