Job Title,Job URN,Company Name,Location,Applicants,Seniority,Employment type,Job function,Industries,Job description,Posted on,Skills
SAS Developer,3689203133,Luxoft,"Singapore, Singapore",75,Mid-Senior level,Full-time,Engineering:Consulting:Information Technology,IT Services and IT Consulting,"Project DescriptionOur Client a leading bank in Asia with a global network of more than 500 branches and offices in 19 countries and territories in Asia Pacific, Europe and North America are looking for Consultants to be part of the project
The Technology and Operations function is comprised of five teams of specialists with distinct capabilities: business partnership, technology, operations, risk governance and planning support and services. They work closely together to harness the power of technology to support our physical and digital banking services and operations. This includes developing, centralising and standardising technology systems as well as banking operations in Malaysia and overseas branches.
The client has more than 80 years of history in the banking industry and is expanding its footprint in Malaysia.The selected resource will be working in a newly setup technology centre located in Kuala Lumpur as part of Technology and Operations to deliver innovative financial technology solutions that enable business growth and technology transformation.
Responsibilities• Working with risk users to understand the business requirements for reporting of Interest Rate Risk in Banking Book(IRRBB) and Liquidity Risk.• Working with Technology to participate in system design, build, user acceptance test, troubleshooting and ensuring that risk user needs are being met in any implementation• Working with other upstream systems to create seamless end to end processes• Working with Change Request Committee to provide plan, status update, and documentation• Providing regular communication with teams on implementation activities• Investigating and resolving issues raised by risk management users• Meeting the tight deadlines and schedules
Must have Skills• 1-9 years of Base SAS programming is essential.• 1-9 years of work experience in project implementations.
• Strong analytical and problem-solving skills• Proactive to work in a fast-paced environment to deliver and meet the deadlines• Highly resourceful, self-motivated, and conscientious with excellent verbal and written communication skills• End-user focused and empathetic
Nice-to-Have Skills:• Knowledge of Treasury Products and Core Banking Products is an advantage.• Knowledge of Intraday liquidity reporting using SWIFT messages is an advantage.• Working experience in BMC control-M Enterprise batch job scheduling software is essential.• Linux shell scripting",28-Sep-2023,Aldon:BMC Control-M:Banking Operations:Jira:Linux:Microsoft Excel:SAS (Programming Language):Shell Scripting
Senior Web Developer (Android / IOS),3722064818,WPH Digital Pte Ltd,"Singapore, Singapore (On-site)",3,Mid-Senior level,Full-time,Engineering:Information Technology,IT Services and IT Consulting,"Job Duties
Design, develop and test applications from scratchDrive requirement analysis, conceptive design, and formulation of architecture, implementation, system integration, testing, documentation and deployment of mobile applications.Create Android / IOS user interface which could work in both mobile and tablet devices.Provide technical leadership in the planning, designing, development, testing, implementation and maintenance of Android and mobile/tablet web applications.Innovate and brainstorm new features for applicationsDevelop and deploy mobile web based applicationsContinuously monitor industry trends, technologies, and standards and be able to research, recommend, and apply new technologies as they emerge.Perform any other ad-hoc tasks given by the Project Manager / Project Director
Skills & Requirements
Diploma or Degree in Computer Science, Information Technology or relevant courses.Experience in Mobile Application Development (iOS (Objective C), HTML5, jQuery & Javascript, Java).Technical knowledge and understanding of a key mobile development platform (Android / iOS)Experience with end to end development for mobile applications (DB, SOA/Middleware and Frontend)Candidate should be keenly interested in exploring new technologies, frameworks and agile to quickly and independently turn around prototypesSelf learner and ability to work independently with limited supervisionExcellent oral, communication and presentation skills.
Note: Proceeding to apply on this job post means you have read, understand and agreed to WPH DATA PROTECTION NOTICE FOR JOB APPLICANTS in the link below.
https://www.wphdigital.com/notices",22-Aug-2023,Android:HTML5:JavaScript:Middleware:Mobile Application Development:Mobile Applications:Objective-C:Service-Oriented Architecture (SOA):iOS:jQuery
Information Technology - Full Stack Developer (KrisPay),3669371303,Singapore Airlines,Singapore (Hybrid),174,Entry level,Full-time,Information Technology,Airlines and Aviation,"Job Description

The successful candidate will join the Application Services (Loyalty Marketing) department in SIA Information Technology Division. As a developer with Kris+/Krispay (world’s first blockchain based airline loyalty digital wallet), you will be working with our team of developers, UX designers and product specialists to enhance our platform, web and mobile channel offering.

Key Responsibilities
Develop and maintain highly reliable, efficient, secure, and scalable API and web application. Work with our CI/CD and release management tools and processes to quickly deliver high quality code. Facilitate the detection, troubleshooting and resolution of pre and post-production issues. Assist with various stages of the API & Web application development lifecycle such as requirements gathering, user interface design and usability testing. Keep abreast of the latest technology and conduct research and prototyping using such technologies. Any relevant ad-hoc duties. This is an individual contributor role. 
Requirements
Possess a degree in Information Technology or related fields At least 5 year of hands-on experience developing API and web applications. Experience and up-to-date knowledge on Modern client server architecture on top of frameworks and technologies (NodeJs, Angular, NoSQL, Mocha, etc.). Experience in test frameworks such as Mocha, Chai, etc. Experience in working with small to medium development teams using Agile methodologies. Knowledge of the mobile technologies. Ability to communicate effectively in English. 
Preferred Skills
Experience in Agile environments, Extreme Programming, Test-Driven Development, Paired Programming, Automation, CI/CD, and git-based source tools. An understanding of various software architectural principles such as MVVM, MVP, SOLID or similar. Experience in mobile backend development on cloud and serverless platforms. Experience in microservice architecture. Knowledge in Android and iOS development. Knowledge of blockchain would be beneficial.",16-Sep-2023,Application Programming Interfaces (API):Blockchain:Extreme Programming:Microservices:Pair Programming:Requirements Gathering:Test-Driven Development:Usability:Usability Testing:Web Applications
"Android Developer, Audio Creation Tools",3725579187,BandLab Technologies,"Singapore, Singapore (Remote)",14,,Full-time,Engineering:Information Technology,"Technology, Information and Internet","Department: Android
Employment Type: Full Time
Location: Singapore
Description
We are looking for a strong middle/senior level Android developer who has experience developing native Android applications with Android SDK. We use cutting-edge technologies and are constantly searching for the best approaches to build our Android application. If you are passionate about Android development and ready to grow fast as a developer, you will fit perfectly within our team.
About The Role
You will work on the development of our musical editor (DAW) which is an application inside of the application with a ton of custom rendering and a native audio engine as a backend. This includes the creation of UI for the editor and work with the native audio engine using JNI and integration with our server API.
Skills, Knowledge And Expertise
Good knowledge of Android FrameworkExperience with complex layouts, animationsYou know how to create the architecture of a new feature and work independently on itGood understanding of multithreading, asynchronous programming, disc, and network IOsYou worked with custom views and renderingWe do not require knowledge of particular technologies but experience with Kotlin, Dagger, RxJava/Coroutines, SQL would be helpful
Optional, but would be a big plus:
You are familiar with music creation, audio recording, processing, sound design or have knowledge of music-making toolsExperience in native development is not necessary but is nice to haveYou don't need to be an expert in DSP but being acquainted with the music-making field would be a plus
Benefits
Healthcare, dental insuranceAttractive paid annual leave, sick leave, childcare leave, volunteer leave and maternity leaveBandLab Technologies staff discountQuarterly bonus",27-Sep-2023,Android:Android Development:Android Framework:Android SDK:Dagger (Software):Framework Design:Multithreading:Parallel Computing:SDKs:iOS
Jr Solution Developer (Intern),3729484142,F5,"Singapore, Singapore (Remote)",38,Internship,Full-time,Engineering:Information Technology,IT Services and IT Consulting,"At F5, we strive to bring a better digital world to life. Our teams empower organizations across the globe to create, secure, and run applications that enhance how we experience our evolving digital world. We are passionate about cybersecurity, from protecting consumers from fraud to enabling companies to focus on innovation.
Everything we do centers around people. That means we obsess over how to make the lives of our customers, and their customers, better. And it means we prioritize a diverse F5 community where each individual can thrive.
Role Overview:
As a Junior Solution Developer (Intern) on the GS Innovation Lab team, you will be working as a core member responsible for the design, development & extension of new & existing features and components within the GS organization. You should bring a strong desire to develop your Data Processing and Data Analytics skills.
Junior Solution Developers are responsible for developing solutions to parse, find patterns, and present data in an intuitive and easy-to understand format. You will be required to see out and contribute to projects right from conception through to final product, requiring good organizational skills and attention to detail.
You are responsible for participating in the production of new ideas, writing code, and responsible for following Agile software development practices in the team. You will work with senior leadership, architects, leads, cross-functional teams, engineers, and other stakeholders to help define and implement solutions.
Sounds interesting? Read on!
What You’ll Do:
Responsible for upholding F5’s Business Code of Ethics and for promptly reporting violations of the Code or other company policies.Writing data adaptors to extract data from various interfaces, be it files, APIs, or database tables. Therefore, a basic understanding of backend technologies is necessary as well.Creating visualizations for the analysis outcome, to be shown on a dashboard portal. Therefore, basic understanding of frontend technologies is also expected.Writing effective, scalable code, and APIs in python.Designing user interactions on web pages.Ensuring responsiveness of applications.Seeing through a project from conception to finished product & post-deployment maintenance.Stay up to date on relevant industry trends and best practices and constantly exchange ideas.Represent the GS Innovation Lab as a member of the core team and participate in these efforts as required.Demonstrate products to internal F5 stakeholders.Communicate trade-offs between expectations and engineering realities to stakeholders and align on prioritization.Perform other related duties as assigned.
What You’ll Bring:
Ability to quickly learn and adopt new technologies.Ability to work well independently and on a cross-functional team.Excellent communication, problem-solving, planning and organization skills.Fluent in various scripting languages for task automation.Linux system administration abilities a plus.Hands-on in SQL with a deep understanding of query optimization a plus.Knowledge of Statistics is a plus.Able to create database schemas that represent and support business processes.Experience in using python libraries such as NumPy, SciPy, Pandas, Scikit-Learn, Matplotlib, and TensorFlow, or the ability to learn any of these quickly, is a plus.Development experience in NodeJS using Express with Angular or React will be an added advantage.Good knowledge of underlying web technologies including HTTP, HTML, and JavaScript.REST based webservices development, microservices, and other related technologies.Python's Web Framework Flask, Django, MySQL, Gunicorn, NGINX and other related technologies, is a plusAssociates or BA/BS degree in computer/engineering related field or equivalent work experienceExperience with any of the following is a plus:NLP, relational databases, ML tools, javascript, software development methodologies, project management methodologies, knowledge of docker containers, Kubernetes, scripting languages.
Physical Demands and Work Environment:
Duties are performed in a normal office environment while sitting at a desk or computer table. Duties require the ability to utilize a computer, communicate over the telephone & video-conference, and read printed material.
The Job Description is intended to be a general representation of the responsibilities and requirements of the job. However, the description may not be all-inclusive, and responsibilities and requirements are subject to change.
Please note that F5 only contacts candidates through F5 email address (ending with @f5.com) or auto email notification from Yello/Workday (ending with f5.com or @myworkday.com).
Equal Employment Opportunity
It is the policy of F5 to provide equal employment opportunities to all employees and employment applicants without regard to unlawful considerations of race, religion, color, national origin, sex, sexual orientation, gender identity or expression, age, sensory, physical, or mental disability, marital status, veteran or military status, genetic information, or any other classification protected by applicable local, state, or federal laws. This policy applies to all aspects of employment, including, but not limited to, hiring, job assignment, compensation, promotion, benefits, training, discipline, and termination. F5 offers a variety of reasonable accommodations for candidates. Requesting an accommodation is completely voluntary. F5 will assess the need for accommodations in the application process separately from those that may be needed to perform the job. Request by contacting accommodations@f5.com.
",28-Sep-2023,Defining Requirements:F5:Fostering inclusivity:Intuitiveness:Job Skills:LabTech:Organization Skills:Parsing:Product Service:Workable Solutions
Software developer- Full stack Mobile developer,3721051058,Michael Page,"Singapore, Singapore (On-site)",10,Entry level,Full-time,Information Technology:Engineering,Insurance:Financial Services:Capital Markets,"Good technology exposure |Growth opportunity 
About Our Client
Our client is a local insurance company. They are a leading homegrown financial services company, offering consumers a better way to financial freedom. Through innovative, technology-enabled solutions and a wide range of products and services they provide consumers control over their financial well being at every stage of their lives.
Job Description
Below are the key responsibilities for this requirement:
 Analysis, development & implementation of change and/or run activity in accordance with the agreed digital/platform strategy, standards and governance for a business unit, project, programme, platform, or feature team Performing value adding governance & quality assurance to ensure customer outcome is delivered to the highest standards Defining technical specifications of solutions in accordance with the agreed digital/platform strategy incorporating service fundamentals, security, and system performance Taking part in continuous improvement through technical and process innovation to optimize the way we deliver to our customers, promoting ways to leverage business benefit at every opportunity The Successful Applicant
A Successfull Candidate Must Have Below
Proactive 'can do' attitude, good verbal and written communication skills enabling effective interaction with both wider IT and Business stakeholdersDemonstrate in depth experience of the Platform they support with practical experience gained over at least a 3-year periodSignificant knowledge of Application Support and Development processes, standards and associated techniques including continuous integration, test driven development, behavior driven developmentPropose innovative solutions or alternative approaches to difficult issuesProven record in delivering technical solutions across run and/or change within this PlatformExperience of working with our Global Sourcing partners and developing solutions which will improve the customer's experienceProven knowledge of technical platforms, software engineering practices and system management methodologiesRequired candidates with full cycle Application development experiencesMobile development experience (iOS/Android) is preferredJEE environment system integration (Windows/Linux)
Experience
An individual contributor who collaborates with the technical teams to assess the impact end-to-end and translate to functional requirements for the teams to buildProgramming knowledge on Angular JS/Typescript/JQuery, iText, Jasper Report, JavaScript Framework, HTML5, CSS3, Webservices (SOAP/RESTful), Bootstrap, Spring Boot, Java J2EE, Data & XML, XSL, Oracle, SQL, Postgres, Jenkins, GIT
Education
Academic: Bachelor's/Master's degree in computer science or information systems (preferred)Professional Certification(s): Agile, Cloud, JAVA (preferred)Complete Fit & Proper assessments successfully on an annual basis at minimum, or when other adjunct appointments are made. What's on Offer
Creative and innovative workplaceOpportunity to learn and growGood work cultureContact: Meenal Sharma
Quote job ref: JN-092023-6176940",15-Sep-2023,Application Development:Full Cycle:HTML5
Full Stack - Developer,3697895733,Orangekloud Inc.,"Singapore, Singapore (On-site)",68,Entry level,Full-time,Engineering:Information Technology,Software Development,"Duties/Responsibilities
Drive development across multiple products and projects for web and mobile applications.Involved in the entire SDLC – requirements gathering, design, development, testing, deployment and support.Maintain and enhance existing web/mobile applications.Writing functional specification document based on requirements gathering.Adopt the best security practices for deployment of the proposed business solutions.To conduct user acceptance training with operational guides document.To participate in the training of internal stakeholders and external clients / partners in the mobile platform when required.
Requirement, Technical Skills
Working experience in Web / Mobile Development involving both front-end and back-end applications.Skillset: Java, ReactJS/VueJS,Javascript and SQL.Familiar with Mobile App and Web Applications best practices.Familiar with Web Services (REST/SOAP) development and deployment.Familiar with code versioning tools such as Git.Possess excellent communication, sharp analytical abilities with proven design skills, able to think critically of the current system in terms of growth and stability.Familiarity with best practices in software development and IT security.Willing to learn, good attitude and team player with strong communication skills.
Optional - Requirement, Technical Skills
Experience in iOS Swift and Android mobile app is preferred.Experience in Hybrid mobile (ReactNative, Cordova…) development is preferred.Working knowledge in Azure Services preferred.Experience in DevOps environment would be a plus.",18-Aug-2023,Back-End Web Development:Critical Thinking:External Clients:Front-End Development:Java:JavaScript:Mobile Application Development:Requirements Gathering:SQL:Working Experience
Full Stack Developer (Hybrid Work),3657889930,CFB Bots Pte Ltd,"Singapore, Singapore (Remote)",231,Entry level,Full-time,Engineering:Information Technology,Information Technology & Services,"CFB Bots is a technology service provider specializing in Intelligent Automation (IA). We partner with large enterprises in their Digital Transformation journey and help them and their employees thrive in the Future of Work. Our mission is to co-create the Digital Workforce of the Future, and our vision is to make work enjoyable. For more information, please visit www.cfb-bots.com.
We are looking for a Full Stack Developer to build robust and scalable software solutions. You’ll be responsible for the full software development life cycle, from conception to deployment.
As a Full Stack Developer, you should be comfortable around both front-end and back-end coding languages, development frameworks and third-party libraries.
Responsibilities
Work with project team to ideate software solutionsPropose and develop new products or features with evolving cutting-edge technologiesDesign client-side and server-side architectureBuild the front-end of applications through appealing visual design and write effective application programming interfaceTest, troubleshoot, debug and upgrade softwareImplement security and data protection settingsWrite technical documentationBuild reusable code and libraries for future use
Requirements
Degree in Computer Science or equivalent qualificationProven experience as a Full Stack Developer or similar roleKnowledge of multiple front-end languages and libraries (e.g. HTML/ CSS, JavaScript, XML, jQuery)Knowledge of multiple back-end languages (e.g. C#, Java, Python) and JavaScript frameworks (e.g. Angular, React, Node.js)Proficient with databases (e.g. MySQL, MongoDB), web servers (e.g. Apache) and UI/UX designDesire to learn and adapt to new technologiesAbility to work independently and effectively in a teamStrong attention to detail, analytical and love solving problemsExcellent communication skills and project management skillsAbility to work in a fast-paced environment",07-Jul-2023,Application Development:Back-End Web Development:Defining Requirements:Front-End Development:Server Side:Stack:Technical Documentation:Upgradation:Visual Design:Web Servers
"Full-stack Developer (Angular, C#) - Aviation industry",3638916934,Page Personnel,"Singapore, Singapore (On-site)",29,Entry level,Full-time,Engineering:Information Technology,Information Technology & Services,"Permanent role |Well-established organisation in the transport and tourism
About Our Client
We are partnering with a well-established organisation in the transport and tourism industry, headquartered in Singapore.
Job Description
Responsible for analysis of current programs, including performance, diagnosis, and troubleshooting of problem programs, and designing solutionsTo build and support high-performance, high-availability, responsive web applicationsAble to conduct system analysis and development to keep our systems current with changing technologiesAble to working in agile methodology to achieve timely and quality delivery The Successful Applicant
Degree in Computer Science/Information Technology and other relevant discipline At least 3 years of relevant experience in full-stack development Proficient with these languages - Angular, ASP.NET Core, HTML, CSS, SCSS, Typescript, JSON, JavaScript, SQL, AWS Lambda, VueJS, NPMWhat's on Offer
Permanent role Well-established organisation in the transport and tourism industry Fun, open-minded and flexible work arrangementsContact: Cheryl Ang
Quote job ref: JN-042023-6019624

Brand: PP",17-Jun-2023,ASP.NET:ASP.NET Core:Amazon Web Services (AWS):Full-Stack Development:JSON:SASS:Stack:Systems Analysis:TypeScript:Web Applications
