Job Title,Job URN,Company Name,Location,Applicants,Seniority,Employment type,Job function,Industries,Job description,Posted on,Skills
Principal Security Analyst,3719685768,Chainlink Labs,Singapore (Remote),27,Mid-Senior level,Full-time,Analyst:Information Technology,"Technology, Information and Internet","All roles with Chainlink Labs are global and remote-based. Unless otherwise stated, we ask that you try to overlap some working hours with Eastern Standard Time (EST). We encourage you to apply regardless of your location. 
About Us
Chainlink is the industry-standard Web3 services platform that enables developers to build feature-rich Web3 applications with seamless access to real-world data and off-chain computation.
 Chainlink has helped enable $8T+ in transaction value since the start of 2022. Over 1,700 Web3 projects have integrated Chainlink services. Chainlink is live on 15+ blockchains with many having joined the Chainlink SCALE program. Chainlink is relied upon by industry-leading protocols like Aave, Compound, Paxos, Synthetix, and ENS. Chainlink has delivered 7.4B+ data points on-chain and onboarded 900+ decentralized oracle networks. Chainlink has established collaborations with Associated Press, Accuweather, AWS, Google Cloud, Meta, and Twilio. The world-class Chainlink Labs research team has won various awards for its work on distributed systems, security, and more.
Who we’re looking for: 
 You’re focused on what matters most and ignore unimportant industry distractions. You take extreme ownership and deliver outstanding results. You have a growth mindset, seek out feedback and engage in constructive dialogue with others to help them grow. You move fast and evolve with rapidly advancing technologies. You want to be part of a team that excels and is committed to building the Chainlink Network and growing the Web3 ecosystem over the long term. You are welcoming toward a diverse network of participants joining an open, global standard. You’re excited about the future of Web3 and building a world powered by cryptographic truth.
The security department is the guardian of Chainlink Labs’ people and infrastructure. Its principal objective is to safeguard Chainlink Labs and its assets against potential threats from any external or internal source. This mission is accomplished through a combination of specialized security engineering, the deployment of cutting-edge technologies, forward-thinking policy development, and the training of highly skilled, security-aware personnel throughout the entire organization.
As an indispensable component of the larger organization, the team seeks to promote a widely understood culture of security, safeguarding our most valuable assets while remaining agile and accessible to all employees and the community.
The Principal Security Analyst is responsible for conducting threat intelligence analysis in alignment with Chainlink Labs’s vision and objectives. The Analyst will play an essential role in defending the firm against sophisticated cyber and physical threats, conducting proactive research on emerging threats, and generating assessments to aid decision-making.
In this role you will: 
Conduct sound analysis to develop forward looking assessments of the geopolitical threat landscape, with specific focus on the Asia-Pacific (APAC) region;Maintain working knowledge of adversarial tactics and techniques, and how they are being used to achieve current objectives;Contribute to and deliver written and verbal briefings for stakeholders;Analyze complex geopolitical issues and assess their relevance to Chainlink Labs and the wider financial sector;Collaborate with and support the investigations of other Cybersecurity Operations and Information Security teams;Support protective intelligence efforts through monitoring, detection, and analysis of potential threats to corporate leadership; Provide thought leadership and act as an APAC subject matter expert in recommending appropriate analytical approaches and methodology in order to address key cyber, i protective intelligence (executive protection), strategic, and physical security issues within the business; Stay updated on emerging trends, threats, and developments specific to the APAC region that may impact the organization;Use both written and spoken Mandarin to communicate and analyze threat intelligence originating from or related to social media and other sources;Use various tools and methodologies to collect, correlate, and analyze threat data, producing actionable assessmentsAssist in the development and refinement of security policies, procedures, and best practices, aligning them with the specific needs and challenges of the APAC region; Set up and manage monitoring systems and alerts focused on APAC-related threats, ensuring timely detection and response to potential security incidents.
Requirements
5-12 years of relevant experience as a security intelligence analyst, geopolitical analyst, and/or similar roles. Strong written and spoken Mandarin skills are essential for analyzing information originating from Mandarin-speaking sources in the APAC region.In-depth knowledge of the geopolitical, economic, and cultural factors influencing the APAC region, including an understanding of regional conflicts, alliances, and trends.The ability to assess how geopolitical developments can impact physical, cybersecurity, and the organization's threat landscape.
Desired Qualifications
Proficiency in data analysis tools and techniques, including data mining, pattern recognition, and statistical analysis, to derive meaningful insights from large datasets.Strong research capabilities to gather information from various sources and the ability to evaluate the credibility and relevance of sources.Excellent written and verbal communication skills to convey complex APAC findings and geopolitical insights clearly and concisely.Familiarity with sentiment analysis tools.The ability to work effectively in cross-functional teams, collaborating with colleagues, for threat intelligence sharing and analysis.Given the evolving nature of threats and technologies, a willingness to continuously learn and adapt to new challenges and trends.Experience with popular social media and deep and darkweb monitoring platforms.
Privacy Policy and an Equal Opportunity Employer: 
Chainlink Labs is an Equal Opportunity Employer. To request an accommodation in our recruitment process, please contact us at people@smartcontract.com .
Please see our Privacy Policy for more information about how we collect and use your application information.",19-Sep-2023,Cyber Threat Intelligence (CTI):Cybersecurity:Data Science:Datasets:Forward Looking:Incident Response:Vulnerability Assessment
SOC Analyst II,3728794781,UST,"Singapore, Singapore (On-site)",20,Entry level,Full-time,Information Technology,IT Services and IT Consulting,"Job Description
Role Proficiency:
Monitor cyber security alerts for our global customers in a 24x7x365 operations team under supervision of Team Lead / senior members of the team.
Outcomes
 Under supervision of senior team members ensure that cyber security alerts from the SIEM and multiple sources are dealt with as per SLA. Seek support of senior members of the team in case of new type incident type or higher complexity. Respond independently to low and medium complexity incidents  Follow documented playbook to ensure consistent and repeatable response to alerts.  Ensure Documentation including in CDC / SIEM work log as predefined / agreed standards. Learn from review process for continuously improvement.  Communicate and escalate as per defined process. Seek advice from senior members of the team when in doubt. Put forward topics for inclusion or upgrade in the playbook to the attention of the senior team members. Assist the lead in the review process for junior team members. Adhere to defined SOC processes including housekeeping tasks. Adhere to the Information Security policies as defined by the company and customer.
Measures Of Outcomes
 Adhere to SLA as agreed with the customer. Productivity (Number of alerts addressed) Quality - Percent of tickets that met quality norms Adhere to process – Nil NC during audits Evidence of skill development including training certification etc.
Outputs Expected
Cyber Security Monitoring:
Work in accordance with the Playbook / under supervision of the team lead to monitor alerts in the CDC Platform / SIEM Tool. etc. Ensure appropriate response in line with the SLA. 
Cyber Security Incident Management:
Work in accordance with the Playbook under supervision of the team lead to process alerts through analysis triage and resolution.Communicate and escalate as per defined processIn accordance with the Playbook under supervision of the team lead complete documentation including annotation in CDC / SIEM work log to ensure audit trail as per defined standards and quality requirements.In accordance with the Playbook under supervision of the team lead ensure that various reports are created and published to stakeholders
Continuous Learning
innovation and optimization:
Ensure completion of learning programs as suggested by ManagersSuggest ideas that will help innovation and optimization of processes. Help develop the ideas into proposals.Provide suggestions for playbook upgrade
Team Work
Assist junior team members where possible.
Skill Examples
 User level skills in use of CDC SIEM and other relevant tools.  Ability to identify Use Cases Use Case and Process Improvement suggestions to the Team Lead for consideration Excellent logical problem-solving ability and analytical skills for incident triage and analysis Good oral and written communication skills. Continually learn new technology and stay updated on cyber threats.  Ability to work in rotating shifts and also be on-call outside of shift hours on a regular and recurring basis. Possess unimpeachable personal and professional integrity. Individuals will be required to submit to a background check.
Knowledge Examples
Knowledge Examples
 1 to 3 years experience in SOC operations with SOC of global organization.  University Degree in Cyber Security (no back papers) / Bachelor’s in Science or Engineering with training in cyber security  Proficient in Cybersecurity Incident Management process.  Up to date in cyber security alerts and incidents; intermediate understanding of enterprise IT Infrastructure including Networks Firewalls OS Databases Web Applications etc.  Understanding of ISMS principles and guidelines; relevant frameworks (e.g. ISO27001)  Desirable – Training / Certification in Ethical Hacking SIEM Tool etc.
Additional Comments
CyberProof is a cyber security services and platform company whose mission is to help our customers react faster and smarter – and stay ahead of security threats, by creating secure digital ecosystems. CyberProof automates processes to detect and prioritize threats early and respond rapidly and decisively. CyberProof is part of the UST Global family. Some of the world’s largest enterprises trust us to create and maintain secure digital ecosystems using our comprehensive cyber security platform and mitigation services. CyberProof is actively seeking new colleagues to join our SOC team. If you are starting your career in cybersecurity and value a supportive environment, open communication between different groups, and an opportunity for upward learning and growth, I highly encourage you to apply for the vacancy or reach out to me directly for more information. The responsibilities of this role include monitoring, investigating, and resolving security incidents, violations, and suspicious activities. The SOC group takes innovative approaches and uses the most cutting-edge technologies to carry out their global operations. Main tasks and accountabilities: Resolve, escalate, report, and raise recommendations for resolving and remediating security incidents. Be an escalation point for investigations of clients and suggest optimization activities to improve their performance. Proactively monitor and review threats and suspicious events from customers participating in the service. Handle the advanced monitoring of system logs, SIEM tools, and network traffic for unusual or suspicious activity Set up SIEM solutions and troubleshoot connectivity issues. Investigate and resolve security violations by providing post-mortem analysis to illuminate issues and possible solutions. Collate security incident and event data to produce monthly exception and management reports. Report unresolved network security exposure, misuse of resources, or noncompliance situations using defined escalation processes. Assist and train team members in the use of security tools, the preparation of security reports, and the resolution of security issues. Develop and maintain documentation for security systems and procedures. Maintain excellent customer satisfaction through professional, proactive and personal service.",27-Sep-2023,Annotation:Customer Satisfaction (CSAT):Cybersecurity Incident Management:Cybersecurity Tools:Defining Requirements:Incident Management:Playbook:Report Manager:Security Incident Management:Service-Level Agreements (SLA)
Cyber Incident Response Analyst - GSO (Singapore),3697907004,TikTok,Singapore,70,,Full-time,Management:Other,Entertainment Providers,"Responsibilities

 TikTok is the leading destination for short-form mobile video. Our mission is to inspire creativity and bring joy. TikTok has global offices including Los Angeles, New York, London, Paris, Berlin, Dubai, Singapore, Jakarta, Seoul and Tokyo. 

At TikTok, our people are humble, intelligent, compassionate and creative. We create to inspire - for you, for us, and for more than 1 billion users on our platform. We lead with curiosity and aim for the highest, never shying away from taking calculated risks and embracing ambiguity as it comes. Here, the opportunities are limitless for those who dare to pursue bold ideas that exist just beyond the boundary of possibility. Join us and make impact happen with a career at TikTok.

The Global Security Organization provides industry-leading cyber-security and business protection services to TikTok globally. Our organization employs four principles that guide our strategic and tactical operations. Firstly, we Champion Transparency & Trust by leading the charge in organizational transparency, prioritizing customer trust, and placing user needs first. Secondly, we aim to maintain Best in Class Global Security by proactively identifying and reducing risks while enabling innovative product development. We constantly work towards a sustainable world-class security capability. Thirdly, we strive to be a Business Catalyst & Enabler by embodying the DNA of technical innovation and ensuring our Global Security operations are fast and agile. Finally, we Drive Empowered & Risk-Informed Decision Making by providing our leaders with the necessary information to make agile decisions based on risk.

As a Cyber Incident Response Analyst, you will be a member of TikTok’s enterprise Threat Detection and Response team. The Threat Detection and Response team is responsible for 24x7 monitoring of multiple security-related information sources to manage incidents related to cyber, privacy, and data protection for TikTok data, infrastructure, and products. The Threat Detection and Response team operates under a follow-the-sun model, with hubs located in Singapore, Dublin and US. The Threat Detection and Response team will regularly survey the TikTok networks for signs of a breach, malware, or unauthorized access. Additionally, the Threat Detection and Response team is responsible for developing and maintaining incident response plans, playbooks and procedures. Finally, the Threat Detection and Response team will be responsible for data collection and analysis of Incident Response data.

Responsibilities
- Triaging security alerts and events from various log sources accurately and responding expediently 
- Conduct technical analysis and assessments of security-related incidents, including malware analysis, packet-level analysis, and system-level forensic analysis
- Conduct analysis of network traffic and output from various network-centric technologies
- Develop Incident Response Playbooks, perform proactive threat hunts based on threat intelligence gathered
- Develop SOAR playbooks, automate routine processes, create or enhance detection and response capabilities 

Qualifications

 - At least 1-3 years of experience handling cybersecurity related incidents
- Technical proficiency in a minimum of at least one of the following domains: Malware Analysis, Digital Forensics, Log Analysis, Red Teaming/Penetration Testing or related domains
- Understanding of networking protocols, traffic analysis, and network security tools (e.g. WAF, NDR)
- Strong Linux fundamentals, experience operating and investigating incidents in *NIX environments
- Familiarity performing log analysis using SIEM tools (e.g. ELK)
- Experience with scripting languages (e.g. Python, Go and PowerShell) for automation and analysis
- Excellent communication skills (verbal and written), teamwork and collaboration skills
- Ability to communicate technical concepts to a broad range of technical and non-technical staff

Preferred Qualifications
- Bachelor's degree in Cybersecurity, Computer Science, or a technical field (or equivalent work experience in related field
- Professional certifications in Cybersecurity (OSCP, GCIH, GREM, GNFA or other relevant certifications)
- Experience in working and investigating incidents in Cloud environments (e.g. AWS, GCP)
- Familiarity with container technologies such as Docker and Kubernetes

TikTok is committed to creating an inclusive space where employees are valued for their skills, experiences, and unique perspectives. Our platform connects people from across the globe and so does our workplace. At TikTok, our mission is to inspire creativity and bring joy. To achieve that goal, we are committed to celebrating our diverse voices and to creating an environment that reflects the many communities we reach. We are passionate about this and hope you are too.",08-Sep-2023,Computer Forensics:Cyber Threat Intelligence (CTI):Cybersecurity:Digital Forensics:Incident Response:Log Analysis:Malware Analysis:Penetration Testing:Red Teaming:Teaming
Threat Analyst (Assistant Manager),3729810983,Synapxe,"Singapore, Singapore (Hybrid)",10,Entry level,Full-time,Information Technology,IT Services and IT Consulting,"Position Overview
Position Summary
The Threat Analyst will play a critical role in defending Singapore’s public healthcare institutions from all cyber threats. The primary responsibility will be to assist the manager in ensuring smooth and effective conduct of threat hunting operations across the public healthcare to quickly detect, disrupt and eradicate hidden threats in the enterprise network and systems.
The new hire will play a critical role in defending Singapore’s public healthcare institutions from all cyber threats. His/her primary responsibility will be to assist the manager in ensuring smooth and effective conduct of threat hunting operations across the public healthcare to quickly detect, disrupt and eradicate hidden threats in the enterprise network and systems.
Looking forward to have someone who is passionate about cybersecurity and would like to work with a team of like-minded professionals.
Role & Responsibilities
 Perform threat hunting to detect, disrupt, and eradicate threats hiding in enterprise networks and systems Perform threat research to identify potential threats, including threat actors and their TTPs Design as well as build custom tools and procedures for threat hunting Assists in developing and tuning detection use cases Performs log analysis for detecting anomalies in various types of logs Contributes in documenting processes, building standard operating procedures
Requirements
 3 or more years of experience in Cybersecurity Operations, Healthtech Informatics or Medical devices and related ICT systems Familiar with security/monitoring tools (e.g. SIEM, WAF, NDR, etc) Good understanding of Cyber security operations and workflows Familiar with the Cyber Kill Chain, MITRE ATT&CK Framework, and NIST Cybersecurity Framework (CSF). Familiar with Medical Device technologies (e.g. PACS, etc) Familiar with Operational Technology (OT) Familiar with AI/ML Candidates with professional cybersecurity certifications would be considered favorably. Degree in Computer Science/Engineering, Information - Systems/Technology, Engineering or equivalent would be a bonus. Self-motivated with the ability to work independently and as a team member with minimal direction. Good interpersonal and stakeholder management skills. Good verbal and written communication skills.
Apply Now
If you are someone who is passionate about cybersecurity and would like to work with a team of like-minded professionals this is the role and team you should be part of
#2324
",29-Sep-2023,CSF:Communication:Cyber Threat Hunting (CTH):Cybersecurity:Defining Requirements:NIST:Performance Motivation:Security Operations:Stakeholder Management:Vulnerability Assessment
Cyber Threat Intelligence Analyst,3668358672,GovTech Singapore,"Singapore, Singapore (Hybrid)",78,Mid-Senior level,Full-time,Information Technology,IT Services and IT Consulting,"The Government Technology Agency (GovTech) is the lead agency driving Singapore’s Smart Nation initiatives and public sector digital transformation. As the Centre of Excellence for Infocomm Technology and Smart Systems (ICT & SS), GovTech develops the Singapore Government’s capabilities in Data Science & Artificial Intelligence, Application Development, Smart City Technology, Digital Infrastructure, and Cybersecurity.
At GovTech, we offer you a purposeful career to make lives better. We empower our people to master their craft through continuous and robust learning and development opportunities all year round. Our GovTechies embody our Agile, Bold and Collaborative values to deliver impactful solutions.
GovTech aims to transform the delivery of Government digital services by taking an ""outside-in"" view, putting citizens and businesses at the heart of everything we do.
Play a part in Singapore’s vision to build a Smart Nation and embark on your meaningful journey to build tech for public good. Join us to advance our mission and shape your future with us today!
Learn more about GovTech at tech.gov.sg.
The Cyber Security Group (CSG) is the cybersecurity arm of GovTech that is committed to creating a safe and secure digital government. The successful candidate will be part of the Incident Response Team that manages and investigates cyber security incidents. As a Cyber Threat Intelligence (CTI) Analyst, you play an important role in identifying and conducting assessment on emerging threats, vulnerabilities and evolving Tactics, Techniques and Procedures (TTP) of threat actors.
What you will be working on: 
Research, analyse and triage various intelligence sources and translate them into actionable cyber intelligence for security operations teamPerform analysis on campaigns, threat actor TTP, indicators of compromise and cyberattack trendsDevelop Cyber Threat Intelligence (CTI) methodologies to facilitate detection and investigationReview threat information and maintain threat intelligence platform (TIP) or threat repositoryProvide threat analysis and landscape report to stakeholders on a timely basis
How to succeed: 
Degree in Information Security, Computer Science, or Cybersecurity or relatedPossess at least 2 years working experience as CTI Analyst or at least 3 years of experience in Incident Response / HandlingExperience in cyber threat intelligence gathering and able to develop patterns related to cyber threatsGood understanding of malware types, malware analysis tools and proceduresStrong understanding of cyber threat analysis models such as kill chain, diamond model, and MITR
What we are looking for: 
Security certifications like CISSP, GCIH, GCTI, GREM an advantageHighly developed research and analytical skillsCritical thinking and contextual analysis abilitiesKnowledge in one or more scripting languages (e.g. Python, Perl) an advantagePossess good communication and interpersonal skillsSingapore Citizen only
GovTech is an equal opportunity employer committed to fostering an inclusive workplace that values diverse voices and perspectives, as we believe that diversity is the foundation to innovation.
Our employee benefits are based on a total rewards approach, offering a holistic and market-competitive suite of perks. These include leave benefits to meet your work-life needs and employee wellness programmes.
We champion flexible work arrangements (subject to your job role) and trust that you will manage your own time to deliver your best, wherever you are, and whatever works best for you.
Learn more about life inside GovTech at go.gov.sg/GovTechCareers.
Stay connected with us on social media at go.gov.sg/ConnectWithGovTech.",22-Sep-2023,CTI:Communication:Cyber Threat Intelligence (CTI):Incident Response:Intelligence Gathering:Working Experience
