Job Title,Job URN,Company Name,Location,Applicants,Seniority,Employment type,Job function,Industries,Job description,Posted on,Skills
Senior Security Analyst (Sail Point),3722435889,Achieve Group,"Singapore, Singapore (On-site)",30,Mid-Senior level,Full-time,Information Technology,IT Services and IT Consulting,"Government Project for a long termGood salary packageFlexible work environment.
Description 7+ years of experience in implementing Identity and access (SailPoint) management project.IAM solution implementation & SailPoint Experience is mandatory.Expert Knowledge in on boarding new applications into SailPoint. Extensive understanding of SailPoint IIQ LCM workflows and experience in customizing workflows. Experience in SailPoint IdentityIQ certifications such as Application Owner certification and Identity certification. Customer facing experience for business requirement gathering, conduct system analysis and finalizing technical/functional specification. · Experience in Custom configurations for connectors, OOTB Connectors, Bean Shell Scripting, SFTP, Lambda scripting etc., Good to have AWS Cloud implementation experience

HOW TO APPLY:Submit your application with your updated Resume in MS Word Format to Prasanna K (EA Personnel Reg. No.: R1873821)Please indicate the below information in your resume:Current & Expected SalaryReason(s) for leavingNotice Period / Availability to commence workNotice:We regret that only short-listed candidates will be notified. All applications will be treated with the strictest confidence.By submitting any application or resume to us, you will be deemed to have read & agreed to the terms of our Privacy Policy, and consented to us collecting, using, retaining and disclosing your personal information to prospective employers for their consideration, and for our marketing EDMs which you may opt out by unsubscribing in the mailer. You may refer and access our website atwww.achievegroup.asia/privacy-policy/ for more information.Cessation of Collection of full NRIC Numbers:
In compliance with the Personal Data Protection Act and commitment to protect candidates’ personal data, Achieve Group will cease to collect, process or use full NRIC numbers during our screening and job application process. Kindly ensure your resumes provided to us does not contain your full NRIC number and full home address during your job application.",24-Sep-2023,Business Workflows:Certification Testing:Identity and Access Management (IAM):Incident Response:LCM:SailPoint:Secure File Transfer Protocol (SFTP):Vulnerability Assessment
Incident Response Team Analyst,3725830345,Meta,Singapore,100,,Full-time,Management:Manufacturing,"Technology, Information and Internet","Meta is seeking a motivated, organised, detail-oriented candidate to join our Incident Response Team. The right candidate must have a strong work ethic, excellent judgment, and exceptional partnering skills.The position is short term (12 months) and would be based in our Singapore office.
Incident Response Team Analyst Responsibilities:
Bring operational excellence to team that evaluates threat, risk and user privacy in world centered around time critical emergency escalations.Review and assess inbound emergency escalations, make immediate decisions based on variety of complex factors that will include imminence, sensitive issues and graphic content and coordinate with a number of internal and external partners including law enforcement in an attempt to ensure user’s safety.Be willing and able to work with sensitive issues and content that includes child exploitation, graphic violence, self-injury and suicide and other content which may be considered offensive or disturbing.Create and articulate written and/or verbal responses to questions from law enforcement, government agencies, and internal teams regarding Incident Response policy and process.Work with cross-functional teams to drive improvements to policies and processes across teams.Availability to work weekend days on a rotational basis or a regular schedule of either Tuesday-Saturday or Sunday-Thursday.
Minimum Qualifications:
Bachelors degree or equivalent experience3+ years of relevant experience in investigative or analytical rolesSelf-starter requiring minimal directionProven ability to make important decisions independently and multi-task under pressure, responding quickly to changing situations in complex environments without compromising quality.Excellent verbal and written communication skills, should be able to adapt communication style to suit different stakeholders like cross-functional teams and law enforcement.Experience with social media, analytical tools, and online research.
Preferred Qualifications:
Experience working with Crisis Management, Government Agencies or Law Enforcement
About Meta:
Meta builds technologies that help people connect, find communities, and grow businesses. When Facebook launched in 2004, it changed the way people connect. Apps like Messenger, Instagram and WhatsApp further empowered billions around the world. Now, Meta is moving beyond 2D screens toward immersive experiences like augmented and virtual reality to help build the next evolution in social technology. People who choose to build their careers by building with us at Meta help shape a future that will take us beyond what digital connection makes possible today—beyond the constraints of screens, the limits of distance, and even the rules of physics.",22-Sep-2023,Analytical Skills:Incident Management:Incident Response:Investigative Research:Multitasking:Online Research:Operational Excellence:Performance Motivation:Product Quality:Vulnerability Assessment
Senior Information Security Watch Analyst,3655072880,TD Securities,"Singapore, Singapore (Hybrid)",187,Mid-Senior level,Full-time,Information Technology,Investment Banking,"TD Bank GroupHeadquartered in Toronto, Canada, with more than 90,000 employees around the world, the Toronto-Dominion Bank and its subsidiaries are collectively known as TD Bank Group (TD). TD offers a full range of financial products and services to over 27 million customers worldwide through three key business lines:
Canadian Retail including TD Canada Trust, Business Banking, TD Auto Finance (Canada), TD Wealth (Canada), TD Direct Investing and TD InsuranceU.S. Retail including TD Bank, America’s Most Convenient Bank, TD Auto Finance (U.S.), TD Wealth (U.S.) and TD’s investment in SchwabWholesale Banking including TD Securities
TD had CDN$1.9 trillion in assets on October 31, 2022. TD also ranks among the world’s leading online financial services firms, with more than 15 million active online and mobile customers. The Toronto-Dominion Bank trades on the Toronto and New York stock exchanges under the symbol ""TD"".
Department OverviewBuilding a World-Class, Diverse and Inclusive Technology Team at TDWe can’t afford to be boring. Neither can you. The scale and scope of what TD does may surprise you. The rapid pace of change makes it a business imperative for us to be smart and open-minded in the way we think about technology. TD’s technology and business teams become more intertwined as new opportunities present themselves. This new era in banking does not equal boring. Not at TD, anyway.
The Fusion Centre is a multi-disciplinary team with global 24/7 representation in Canada, United States, Israel, and Singapore providing timely response and coverage necessary to review, triage and investigate incidents.
We are looking for someone to support the Fusion Centre’s Watch team. The Watch team facilitates comprehensive incident response and timely information sharing with Senior Executives on incidents impacting or of interest to the Bank. In collaboration with partner teams, Watch team members triage, coordinate taskforces, respond to and issue written communications on complex threats, events and incidents. Through its work, Watch builds and promotes shared awareness through effective incident coordination and communication. The position reports to the Senior Manager, Fusion Watch.
There’s room to grow in all of it.
Job DescriptionWe are looking for someone to join TD’s Fusion Centre Watch Team as a Senior Information Security Analyst. The Fusion Watch team is responsible for incident and crisis management, ensuring coordination and collaboration for response efforts. This team provides executive communications and incident coordination for cyber security/cyber-fraud incidents and proactive risk mitigation initiatives. As well, Fusion Watch supports other threat management teams such as Cyber-Fraud, Physical Security, and Insider Risk. In this role, you’ll be responsible for booking and hosting incident response/risk mitigation calls, creating and updating incident response documentation, and drafting and issuing communications. You will also play a role in shaping the evolution of this fast-growing team and the Fusion Centre’s approach to protecting the Bank. We will review candidates that reside near one of TD’s locations in the US to work in a hybrid capacity and will also consider applicants interested in remote work.
Participate in the Watch team’s rotating on-call schedule; while on rotation, you may be called in outside of normal business hours to respond to an incident.Liaise and support assembly of stakeholders during cyber incidents, cyber-fraud events or crisis events, as well as facilitate taskforce meetings and communication bridges.Build and maintain relationships, and during incidents work with internal stakeholders throughout the incident management lifecycle (i.e., Business LoBs, Technology groups, Fusion/cyber teams (CSOC/CSIRT), Threat Intelligence, Risk, Fraud, Physical Security, legal, and executive community).Engage with information sharing teams to create non-technical communication materials to inform critical stakeholders on emerging events that have or may have impact to TD to ensure consistent information is gathered and shared with appropriate stakeholders.Assist in managing the incident confluence site, JIRA task triaging and workstream assignment.Communicate to impacted teams and key stakeholders using appropriate language targeted to the audience.Facilitate timely engagement and coordinate incident response with core Fusion Centre partners during active information security events/incidents, by facilitating calls, taking minutes, and tracking action items.Engage key stakeholders to conduct a detailed internal assessment of TD’s readiness against a scenario experienced by the external party.Establish and maintain Fusion Watch communication and coordination playbooks (for internal incidents and external ‘celebrity’ events), maintain comprehensive list of Fusion Centre partners required for response and contribute to the continuous improvement of the team’s practice/processes.Contribute to the development and delivery of Fusion communication products.Contribute to regular Fusion Centre reporting.Build and maintain relationships with business units and key stakeholders.Adhere to policies, procedures, technology control standards and regulatory guidelines.Contribute to internal activity and process review, flag windows for improvement.Assess, identify, and escalate issues appropriately.
RequirementsUniversity Degree.5 - 7 years of relevant experience.Previous work experience in Crisis Management, Cyber Security, Threat/Cyber Intelligence, SOC, CSIRT (Cyber Security Incident Response Team), Fraud/Cyber-Fraud or incident management is considered a strong asset.Knowledge and background in Information Technology, Information Security, Fraud/Cyber-Fraud or Cyber Security considered an advantage.Information Security, Incident Management or Investigation certificate/accreditation/experience is a plus.Experience in incident coordination and preparedness with the ability to provide timely analysis and documentation for incident and exercise reporting.Strong written and verbal communication skills, able to exercise judgment and to communicate complex issues in a clear, simple and/or understandable manner.Experience working with executive audiences, senior leadership, and varying levels of stakeholders.Excellent organizational, analytical, and problem-solving skills with a strong attention to detail.Excellent time-management and organizational skills to manage multiple deadlines and tasks with varying priority levels.Strong time management, organization skills and business acumen.Understanding of TD’s organizational structure, infrastructure, products, and services.
Inclusiveness:At TD, we are committed to fostering an inclusive, accessible environment, where all employees and customers feel valued, respected and supported. We are dedicated to building a workforce that reflects the diversity of our customers and communities in which we live and serve and creating an environment where every employee has the opportunity to reach their potential.",27-Sep-2023,Cybersecurity:GCIA:GCIH:GPEN:Information Security:Network Security:RSA Security:Security Information and Event Management (SIEM):Security Operations:Splunk
"Lead Information Security Analyst, APAC (AVP/VP)",3721851747,Wells Fargo,"Singapore, Singapore",39,Executive,Full-time,Information Technology:Engineering,Financial Services:Investment Management:Banking,"About This Role
Wells Fargo is seeking a Lead Information Security Analyst responsible for providing information security expertise and proactive risk-based solutions to aligned business and/or applicable teams that report to aligned Business Information Security Office (BISO) so that information security risks are addressed in a timely manner.
Information & Cyber Security (ICS) is part of Wells Fargo Technology organization. Wells Fargo views information security as enabling lines of business to mitigate information security risk in accordance with our risk appetite. Through a framework that addresses policy, process, operations, people, and technology, ICS protects our infrastructure, corporate data, and customer assets, and ensures alignment with applicable regulations and laws. Our vision is to provide Wells Fargo with world-leading cyber security risk management.
Learn more about the career areas and lines of business at wellsfargojobs.com
In This Role, You Will
 Works closely with the Regional Control and Risk teams to proactively identify needed security practices within the business.  Provides technical understanding of existing and emerging information security risks.  Assists with the monitoring, reporting and tracking of ICS programs within the business.  Provides regional and business views to align Business Information Security Office (BISO) strategy.  Evaluates the appropriateness of policy exceptions and risk acceptances.  Assists the aligned Business ISO with providing strategic-level consultation to managers and stakeholders regarding long and short range information security risk/requirements.  Recommends innovations that anticipate future directions of both the business, Information Technology and Information Security.  Understand the regional local regulatory requirements and how these regulations impact Information Security risk within the region.  Provide coverage / support for other regions in different time zones (i.e. US timezone).  Coordinate vulnerability assessments and provide oversight in LOBs 3rd party IS assessments for the   Required Qualifications: 
 5+ years of Information Security Analysis experience, or equivalent demonstrated through one or a combination of the following: work experience, training, military experience, education   Desired Qualifications: 
 BS/BA degree or higher in science or technology  6+ years of experience in compliance, operational risk management (includes audit, legal, credit risk, market risk, or the management of a process or business with accountability for compliance or operational risk), or a combination of both;  Or 6+ years of IT systems security, business process management or financial services industry experience, of which 3+ years must include direct experience in compliance, operational risk management, or a combination of both  5+ years of information security experience  6+ years of Information Security Frameworks and standards (FFIEC, NIST, ISO) experience  Strong analytical skills with high attention to detail and accuracy  Ability to interact with all levels of an organization  Ability to influence and build relationships with LOB stakeholders, technology CIO leadership, external service providers, and architecture teams  Knowledge and understanding of information security risk assessment procedures, risk mitigation or remediation  Ability to articulate issues, risks, and proposed solutions to various levels of staff and management  Virtual leadership experience with ability to effectively drive results, provide feedback/direction, and manage and build relationships with leaders and team members in a geographically dispersed team environment  Ability to travel if require   We Value Diversity 
At Wells Fargo, we believe in diversity, equity and inclusion in the workplace; accordingly, we welcome applications for employment from all qualified candidates, regardless of race, color, gender, national origin, religion, age, sexual orientation, gender identity, gender expression, genetic information, individuals with disabilities, pregnancy, marital status, status as a protected veteran or any other status protected by applicable law.
Employees support our focus on building strong customer relationships balanced with a strong risk mitigating and compliance-driven culture which firmly establishes those disciplines as critical to the success of our customers and company. They are accountable for execution of all applicable risk programs (Credit, Market, Financial Crimes, Operational, Regulatory Compliance), which includes effectively following and adhering to applicable Wells Fargo policies and procedures, appropriately fulfilling risk and compliance obligations, timely and effective escalation and remediation of issues, and making sound risk decisions. There is emphasis on proactive monitoring, governance, risk identification and escalation, as well as making sound risk decisions commensurate with the business unit's risk appetite and all risk and compliance program requirements.
Candidates applying to job openings posted in US: All qualified applicants will receive consideration for employment without regard to race, color, religion, age, sex, sexual orientation, gender identity, national origin, disability, or status as a protected veteran.
Candidates applying to job openings posted in Canada: Applications for employment are encouraged from all qualified candidates, including women, persons with disabilities, aboriginal peoples and visible minorities. Accommodation for applicants with disabilities is available upon request in connection with the recruitment process.
 Drug and Alcohol Policy 
Wells Fargo maintains a drug free workplace. Please see our Drug and Alcohol Policy to learn more.
Reference Number
R-304877",15-Sep-2023,Business Process Management:FFIEC:ISO Standards:Information Security:Information Security Analysis:Operational Risk Management:Security Analysis (Securities):Security Risk:System Safety:Vulnerability Assessment
SOC Analyst (Security Operations Center),3711951740,NITYO INFOTECH SERVICES PTE. LTD.,"Singapore, Singapore (Hybrid)",35,Entry level,Full-time,Information Technology,,"Nityo Infotech is looking for a SOC Analyst.
Working location: Hampshire Rd, Singapore
Description Of Systems To Be Supported
ArcSight, CyberArk, Imperva and other IT security related systems.
Responsibilities
 Provide technical support, advise and implementation to the various phases of development, user acceptance testing, production and disaster recovery, where applicable, for all security systems Installation and maintenance of the security systems and security compliance. Interact with clients (internal or external) to understand and meet requirements for the delivery of services related to security products. Prepare weekly and monthly operational, availability and SLA reports. Coordinate with vendors for hardware break fix and project activities. Prepare for new or changed services, management of the change process, management of
performances of systems and services in relation to their contribution to business performance.
 Support the operation and maintenance of vendor products, services and solution. Perform sizing, troubleshooting services and manage critical client situations related to security Systems. Support power shut down / start up activities for Security Systems.
Duties
 Monthly log extraction Audit trail review Advisory alerts McAfee Definition update/Hash update Email reporting Imperva Daily Healthcheck",05-Sep-2023,
Digital Forensic Incident Response Analyst (Malware Analysis),3724845699,GovTech Singapore,"Singapore, Singapore (Hybrid)",6,Mid-Senior level,Full-time,Design:Art/Creative:Information Technology,IT Services and IT Consulting,"The Government Technology Agency (GovTech) aims to transform the delivery of Government digital services by taking an ""outside-in"" view, putting citizens and businesses at the heart of everything we do. We also develop the Smart Nation infrastructure and applications, and facilitate collaboration with citizens and businesses to co-develop technologies.
Join us as we support Singapore’s vision of building a Smart Nation - a nation of possibilities empowered through info-communications technology and related engineering.
You will play a key role in the Government Cyber Defence (GCD) of Cyber Security Group (CSG) as Digital Forensic and Incident Response (DFIR) Analyst/Investigator to manage and investigate cybersecurity incidents.
Successful candidate will be responsible for delivering three core domains, incident response, digital forensics and malware analysis/Reverse Engineering, specialising in either one of the domains. Candidate needs to have the passion for DFIR and have the desire to learn and improve. Critical thinking and great communication skills are necessary for this role to convey technical concepts and advise decision makers on the best course of action.
What you will be working on: 
Ensure timely response to security incidents, root cause analysis and closure of incident Investigate cybersecurity incidents that may involve digital forensic analysis, malware analysis and log analysisConduct Malware analysis and reverse engineering when required.Ensure proper Malware Reversing report is delivered.Assess cybersecurity threats and vulnerabilitiesDevelop and test incident response playbooks and processesMaintain situational awareness and keep current with cyber security news and threat actor Tactics, Techniques and Procedures (TTPs)Prepare and review incident reports to update stakeholders
What we are looking for: 
Bachelor’s Degree in Computer Science/Information Security or equivalent Professional certifications, including EnCE, GCFA, GREM, GNFA, GCTI, CISSP or other relevant certificationsPreferably 2 years or more of experience as a full time incident responder/digital forensic/malware analysis or related disciplineUnderstanding of operating systems and platform (e.g. Windows, Linux) Knowledge of computer networking, LAN, and serverProficient in Forensic Tools such as Encase, FTK or AutopsyExperience in more than one programming languages or scripting (e.g. C++, Python, Go)Ability to perform basic static and dynamic malware analysisAbility to analyse network and application logsGood working knowledge of Cloud and Container technologies are a plusFamiliarity with good security practices
Other Requirements: 
Ability to multitask, prioritise and solid attention to detailsDemonstrate a high degree of integrity, initiative, energy and endurance Willingness to learnPossess good communication and interpersonal skillsFresh Graduates can also be consideredSingapore Citizen only
We are an equal opportunity employer and value diversity at our company as we believe that diversity is meaningful to innovation. Our employee benefits are based on a total rewards approach, offering a holistic and market-competitive suite of perks. This includes generous leave benefits to meet your work-life needs. We trust that you will get the job done wherever you are, and whatever works best for you – so work from home or take a break to exercise if you need to*. We also believe it’s important for you to keep honing your craft in the constantly-evolving tech landscape, so we provide and support a plethora of in-house and external learning and development opportunities all year round.
Subject to the nature of your job role that might require you to be onsite during fixed hours",22-Sep-2023,Communication:Computer Forensics:Digital Forensics:Forensic Toolkit (FTK):Incident Response:Interpersonal Skills:Malware Analysis:Reverse Engineering:Root Cause Analysis:Skilled Multi-tasker
