Job Title,Job URN,Company Name,Location,Applicants,Seniority,Employment type,Job function,Industries,Job description,Posted on,Skills
Security Operations Center (SOC) Analyst,3623074994,Aspire,"Singapore, Singapore (Hybrid)",446,Entry level,Full-time,Information Technology,Financial Services,"Aspire is the leading all-in-one finance operating system for growing businesses in APAC. We are on a mission to reinvent business finance for a new generation of entrepreneurs and business owners, empowering startups and MSME to realise their full potential.
Founded in 2018, Aspire has raised over USD 300M+ across equity and debt from world-class investors. In 2023, we successfully closed an oversubscribed USD 100 million Series C equity round led by Sequoia Capital and Lightspeed Ventures with participation of Tencent, Paypal Ventures, LGT Capital Partners, Picus Capital and MassMutual Ventures. To power our solutions, we have partnered with some of the best companies in the world such as Visa and Wise and helped more than 15,000 businesses using our suite of products.
In 2022, we were awarded Best Employer of the Year and Payments Tech of the Year by Asia Fintech Awards, ranked #1 on LinkedIn's 2022 Top Startups list and were listed on YC Top Companies 2022. In 2023, we ranked Top 10 on The Straits Times Fastest-Growing Companies.
You will be amazed by the energy and experience of our team. We are a team of ex-entrepreneurs, ex-founders, and high-achievers with international backgrounds. We team up to reach the highest standards in what we do, and don't take NO for an answer.
We are expanding rapidly. Are you a top talent? Are you passionate about entrepreneurship? Join us and make an impact in the fintech space.
About the team: 
At Aspire, we recognize that data and infrastructure security are paramount to the success and trust of our customers. Our Security Team is at the forefront of protecting and securing our systems, ensuring compliance with industry best practices, and continuously learning and evolving to stay ahead of emerging threats. Our emphasis extends to data privacy, seamlessly integrating it into our security initiatives.
About the role:
As the IT Operations/Security Operations Center (SOC) Analyst, you will be responsible for ensuring the proper administration of our IT systems, building the SOC, responding to security alerts and incidents. You will be reporting to Aspire’s Head of Information Security and will have the exciting opportunity to be part of a fast-growing team of security specialists within the company. Currently there is little need for any on premise administration or physical tasks. We are looking for someone who has experience with cloud environments and Software as a service (SaaS).
What will you be doing? 
 Monitoring and analyzing security logs and alerts to identify potential security incidents.  Investigating and responding to security incidents and audits in a timely and effective manner.  Collaborating with IT and other teams to implement security measures and controls to protect against potential threats.  Participating in incident response and disaster recovery planning and exercises.  Supporting IT integration operations, including (partly) hardware and software maintenance, backups, and system updates.  Providing technical support to internal teams and end-users.  Supporting the security architecture of the SOC tools and other IT technologies.  Responding, documenting and reporting on security incidents and IT operations.  Continuously improving IT operations processes and procedures to ensure efficient and secure service delivery.  Writing user manuals, procedures standard operating procedure (SOPs) and FAQs  Supporting and driving other daily IT and security tasks 
We would love to get to know you if you have the following: 
Minimum (need to have!):
 Based in ±4 hours to the Singapore timezone (GMT+8) e.g. India, Vietnam, Philippines.  Good to very good written and spoken English communication skills.  Studied at a University or polytechnic. Experience with triaging of security events, Azure Sentinel, Azure LogAnalytic Workspace, Azure Logic Apps, DataDog SIEM, MS Defender, Python and Jira. Experience in memory forensic, malware analysis, network traffic and log analysis. Someone who keeps up-to-date with the latest security trends and technologies to maintain a strong security posture. Building, maintaining and operating a SOC. 
The ideal candidate should have (optional):
 A degree in Computer Science, IT, Engineering or a related qualification.  Exposed to AWS, GCloud, GitHub, Okta, Notion and Google Work Space, 1Password, CloudFlare, Azure Logic Apps and malware analysis.  Retesting of penetration testing findings.  Worked Linux environments.  Software development experience e.g. Python , Go, Bash, Powershell. Personal electronics or computer science related projects in a personal blog or Github. 
What We Offer
Work from anywhere and Work from Home subsidy. Uncapped flexible annual leave. Training subsidy for your professional growth. Wellness benefit. Team bonding budget to foster collaboration and sense of belonging. Culture is Key: Most importantly, we always strive to cultivate a special culture that brings special talents together - You may learn more about our culture at our careers site and LinkedIn Life page . 
Equal Opportunity Statement 
Aspire is an equal opportunity employer and is committed to providing equal employment opportunities to all qualified individuals without regard to race, color, religion, sex, sexual orientation, gender identity, national origin, age, disability, or any other protected characteristic as outlined by applicable laws.
Please note: by submitting your application, you acknowledge that you have read and understood Aspire’s Data Protection Policy for Employees, Freelancers, Contractors and Job Applicants (the “Policy”) , and consent to the collection, use and disclosure of your personal data by Aspire for the purposes set out in the Policy. You may withdraw consent for such collection, use and disclosure, and make an access or correction request in respect of your personal data, in accordance with the Policy by emailing people@aspireapp.com .",16-Sep-2023,Azure Logic Apps:Forensic Analysis:Incident Response:Log Analysis:Malware Analysis:Memory Forensics:Retesting:Security Operations:Security Operations Center:Vulnerability Management
Cyber Threat Analyst (CTI),3726229883,Nicoll Curtin,"Singapore, Singapore (On-site)",58,Mid-Senior level,Full-time,Information Technology,IT Services and IT Consulting,"This is a permanent position based in Singapore with our client, a global technology firm. 
In this role, you will be working within a team to perform real-time analysis of security log data from various security devices and systems. You will also be Identifying cyber risks and come up with mitigation plans or improvements in the processes. 
Another major part of your role would be to conduct research and analysis of the current and upcoming threats within the cyber world. 
We are looking for candidates with a minimum of 3 years of experience or more within this field. Ideally you would have experience within the financial services or technology sector. Candidates must have conducted analysis on exploitation within payments or e-commerce associated from the deep/dark web or other underground sources. You should also possess technical skills within data analysis, mining, and Pen testing.",28-Sep-2023,Cyber Security Risk:Cyber Threat Intelligence (CTI):Cybersecurity:Data Analysis:Information Security Management:Penetration Testing:Python (Programming Language):Research Skills:Threat Analysis:Threat Modeling
SOC Analyst - Junior to Team Lead,3693010901,JAC Recruitment,"Singapore, Singapore (On-site)",125,Mid-Senior level,Full-time,Information Technology,Staffing and Recruiting,"Company Overview
Our client is a Singapore based security solution provider. Due to high demand in the market, they are looking for a SOC Analyst (L1 ) Junior to Team Lead to join their team.
 Responsibilities: 
 Serve as the first responder for incidents within a 24/7 staffed SOC environment.  Conduct security monitoring, vulnerability management, data loss prevention, policy violation prevention, and threat hunting activities.  Monitor security sensors and analyze logs to identify network anomalies and intrusions.  Perform analysis of security log data from various security devices.  Escalate security incidents according to established policies and procedures.  Communicate with Ensign customers regarding security intrusions, root cause analysis, and provide mitigation recommendations.  Conduct initial analysis of security events, network traffic, and logs.  Assist in developing incident response plans, workflows, and standard operating procedures (SOPs).  Collaborate with threat intelligence analysts to translate intelligence into actionable detection measures.  Monitor and analyze Managed Endpoint and Detection Response (MDR) platforms, taking necessary response actions based on standardized workflows and client agreements.  Act as a liaison for configured alerts, monitoring the performance of security sensors and tools.  Fulfill change requests, service requests, and respond to internal and external inquiries related to incident management. 

 Requirements: 
 Diploma/Degree in Information System/Information Security from a recognized institution.  Minimum 1 year of working experience  Solid understanding of network routing and switching fundamentals, including Multiprotocol Layer Switching (MPLS).  Basic technical knowledge of operating systems, network architecture, and design.  Familiarity with encryption, key management, and cryptology.  Strong organizational and prioritization skills.  Ability to analyze problems, identify root causes, and propose and implement effective solutions.  Excellent written and verbal communication skills.  Results-oriented mindset. 

Working Location: Singapore
Apply online or feel free to contact me directly (via email: audrey.teo@jac-recruitment.com) for more information about this opportunity. Due to the high volume of applicants, we regret to inform that only shortlisted candidates will be notified. Thank you for your understanding.
Audrey Teo Wei Shan (R 21101086C)
JAC Recruitment Pte Ltd (EA Lic No: 90C3026)
#countrysingapore
",13-Sep-2023,Cryptography:Cyber Threat Hunting (CTH):Cyber Threat Intelligence (CTI):Encryption:Incident Response:Key Management:Multiprotocol Label Switching (MPLS):Network Architecture:Packet Switching:Root Cause
Security Operations Center Analyst,3618785377,Harrington Starr,"Singapore, Singapore (Hybrid)",680,Mid-Senior level,Full-time,Information Technology:Analyst,Staffing and Recruiting,"Security Operations Analyst/ SOC Analyst required by global financial services organization based in Singapore. On offer is the chance to join a technically innovative Global Security Operations Centre in an exciting new role. This role is a greenfield role as the company are moving from an outsourced to in-house model. It will give the candidate the chance to work on more proactive security operations tasks such as threat hunting, purple teaming and reverse engineering.Shifts are: 07:00 – 19:00 or 08:00 – 20:00 (subject to UK BST) using a 4 days on, 4 days off rotation.
Please note in the first instance we will only be able to take applications from Singapore nationals and permanent residents.
On a day to day basis the role will include:Triaging security incidentsSIEM monitoring for incident investigations/ for the development of monitoring dashboards.Use of playbooks, on-line resources and threat intelligence to enhance attack detectionCreation of new\ updating existing playbooksKeep up to date with current vulnerabilities and attack techniques
Key skills needed:Experience in a technical cyber security operations roleStrong knowledge of TCP/IP networking, and common protocols effected by malwareBasic programming/ scripting skills (Bash, python, PowerShell etc.Experience of working with a SIEMUnderstanding of tools/ techniques used by attackersAny industry certs (CISSP, CHE, OSCP etc) highly desirable",15-Aug-2023,Banking:Certified Information Security Manager (CISM):General Data Protection Regulation (GDPR):Information Security:Information Security Management:Network Security:Powershell:Python (Programming Language):SOC 2:Security Management:Stakeholder Management
"Lead Security Analyst, Secure Code Review",3382604232,GXS Bank,"Singapore, Singapore",60,Mid-Senior level,Full-time,Information Technology,Financial Services,"We are living in dynamic times. Technology is reshaping how we live, and we want to use it to redefine how financial services are offered. Grab is the leading technology company in Southeast Asia offering everyday services to the masses. Singtel is Asia’s leading communications group connecting millions of consumers and enterprises to essential digital services. This is why we are coming together to unlock big dreams, and financial inclusion for people in our region is just one of them.

Get to know the Role:

You should possess an extensive hands-on experience in solutions design and development and a deep understanding of web and mobile application security, API security, container security, data protection. You should also understand basic concepts, and be able to learn advanced concepts, about cryptography, networking security, operation system security.

Roles & Responsibilities:
Perform secure design review, secure code review, threat modeling, and assist developers in triaging scan results.Develop comprehensive and accurate reports and presentations for both technical and executive audiences and make recommendations for security improvements.Effectively communicate findings and strategy to stakeholders including technical staff and executive leadership.Develop secure coding guidelines, training courses on secure coding best practices, related to cryptography, authentication, access control, etc.Leading engagements with Engineering teams from scoping through remediation, and mentoring less experienced staff. 

The day-to-day activities:

A typical job could be reviewing source code and configuration of mobile applications and APIs, to identify potential vulnerabilities to bypass security controls. If, just by reading the source code, you can find secrets hardcoded in the mobile application or in configuration files, identify a weak implementation of cryptographic controls, present relevant data in a digestible manner, think well outside the box, or are astute enough to quickly learn these skills, then you’re the type of Analyst we’re looking for.

The must haves:
Strong background in coding, fluent in several modern programming languagesExcellent understanding of secure design and coding best practices.Experience using scanning tools for mobile, API and web application security testing.At least 8 years experience with a minimum of 3 of the following:Strong experience with AWS, Azure or GCPDesign of highly-available and highly-secure solutions in financial sectorDesign of container-based infrastructures in the cloudDevelopment of mobile applications, RESTful APIs, web applicationsSecure code review of mobile applications, RESTful APIs, web applicationsAny of the following certifications and experiences would be a plus: Certifications from AWS, Azure or GCP related to solutions architecture, development or securityCybersecurity certifications, such as OSWE, CCSLP, GWEBSpeaker at developer or security conferences, such as Devoxx, GopherCon, Defcon or BsidesAuthor or contributor in F/OSS projects",09-Sep-2023,Cryptography:Cybersecurity:Data Privacy:Enterprise Solution Design:Incident Response:Network Security:Networking:Secure Code Review:Security Controls:Technical Solution Design
"SOC Analyst for Cyberproof, Singapore",3718296159,UST,"Singapore, Singapore (On-site)",126,Associate,Full-time,Engineering,Telecommunications,"About the PositionThe Security Operations Group of CyberProof consists of a global team of highly talented people. With 100+ highly experienced, certified cyber security experts, researchers and analysts, majority of our tier 3-4 expertise comes from Israeli Intelligence.
Work Location: 300 Beach Road, Singapore
 SOC Analyst:
Job DescriptionResolve, escalate, report, and raise recommendations for resolving and remediating security incidentsHandle the advanced monitoring of system logs, SIEM tools, and network traffic for unusual or suspicious activitySet up SIEM solutions and troubleshoot connectivity issuesInvestigate and resolve security violations by providing post-mortem analysis to illuminate issues and possible solutionsCollate security incident and event data to produce monthly exception and management reportsReport unresolved network security exposure, misuse of resources, or noncompliance situations using defined escalation processesAssist and train team members in the use of security tools, the preparation of security reports, and the resolution of security issuesDevelop and maintain documentation for security systems and proceduresRecommend, schedule, and apply fixes, security patches, and any other measures required, in the event of a security breach
Experience & Qualifications RequiredMinimum 1 years of experience as a Analyst working as part of a SOC teamExperience with SIEM vendors such as QRadar, ArcSight, RSA, and LogRhythm, Splunk.Experience in incident response, and in writing procedures runbooks and playbooksAbility to work with customer’s IT and security teams",20-Sep-2023,ArcSight:Cybersecurity Tools:IBM QRadar:Incident Response:LogRhythm:RSA Security:Reporting:Security Information and Event Management (SIEM):Security Systems:Splunk:Teamwork
"Manager, SOC Analyst",3685795752,UOB,"Singapore, Singapore (Hybrid)",51,Associate,Full-time,Information Technology:Consulting:Engineering,Banking:Financial Services,"About UOB

United Overseas Bank Limited (UOB) is a leading bank in Asia with a global network of more than 500 branches and offices in 19 countries and territories in Asia Pacific, Europe and North America. In Asia, we operate through our head office in Singapore and banking subsidiaries in China, Indonesia, Malaysia and Thailand, as well as branches and offices. Our history spans more than 80 years. Over this time, we have been guided by our values – Honorable, Enterprising, United and Committed. This means we always strive to do what is right, build for the future, work as one team and pursue long-term success. It is how we work, consistently, be it towards the company, our colleagues or our customers.

About The Department

Group Technology and Operations (GTO) provides software and system development, information technology support services and banking operations.

We have centralized and standardized the technology components into Singapore, creating a global footprint which can be utilized for supporting our regional subsidiaries and the branches around the world. We operate and support 19 countries with this architecture to provide a secure and flexible banking infrastructure.

Our Operations divisions provide transactional customer services for our businesses while also focusing on cost efficiency through process improvements, automation and straight through processing.

Job Responsibilities

The Security Operation Center (SOC) is seeking enthusiastic, passionate and technically strong Cyber Security Senior Analyst. Analyst will act as subject matter expert for SOC.
Perform deeper analysis, trending and root cause analysis of the events/incidents handled by SOC Analyst.Work on escalated security incidents (malware infections, unauthorized access, malicious emails, Phishing, Distributed Denial of Service (DDoS) attacks, etc.)Analysis of cyber threats by deep packet inspection.Detection of threat by analyzing large set logs from different security & Network devices, different Operating system, Databases, Web servers/Applications etc.Enhance and Build Cyber threat detection use cases and assist in analyzing & reducing false positive.Identify infection/compromise in the company utilizing threat intelligence and indicators of compromise (IOCs) from different threat Intel sources and regulators.Interface with Cyber Intel, Engineering and security teams.Assist in Incident Response for Detected/Reported Cyber security Incidents.Generate security reporting and metrics as requiredProcess improvement and coaching to SOC Analyst.Stay current on the latest Cyber threats, Attacks and vulnerabilities etc. 

Job Requirements

Education
ITC/Diploma/Degree in Computer Science / IT Security from a recognized education institutionProfessional security related qualification (e.g. SANS GCIA, GSEC, GCIH) will be favorable although not mandatory

Technical Skills
Min 3 to 5 years of relevant experience in similar in SOC, Cyber Security Analysis, Investigation and Incident responseStrong understanding of Networking, Operating System and Cyber Security concepts.Strong practical experience in Cyber security: Cyber kill chain, TTP, threat intelligence, malware triageStrong understanding of Different Attacks on System, Network, ApplicationsStrong knowledge in Internet infrastructure, networking technology and network security (i.e. DNS, DHCP, Firewall, WAF, IDS, IPS, VPN, APT and TCP/IP protocols)Malware triage and analysis capability will be an advantageWorking experience with major SIEM will be an advantageExpert in analyzing different logs to detect cyber threats (i.e. Security Devices, Operating Systems, Network Devices, Databases, and Application/Web Servers etc.)

Soft Skills
Good written and verbal communication skillsProcess and procedure adherenceStrong analytical and problem solving skill

Other Requirements
Willing to perform 24X7 shiftGood teamwork

Be a part of UOB Family

UOB is an equal opportunity employer. UOB does not discriminate on the basis of a candidate's age, race, gender, color, religion, sexual orientation, physical or mental disability, or other non-merit factors. All employment decisions at UOB are based on business needs, job requirements and qualifications. If you require any assistance or accommodations to be made for the recruitment process, please inform us when you submit your online application.

Apply now and make a difference.",17-Sep-2023,Cyber Threat Intelligence (CTI):Cybersecurity:Incident Response:Information Security Analysis:Malware Analysis:Quantitative Analytics:Security Analysis (Securities):Security Information and Event Management (SIEM):Security Operations:Triage
Security Operations Center Analyst,3722489876,Nityo Infotech,"Singapore, Singapore (On-site)",110,Associate,Full-time,Information Technology,IT Services and IT Consulting,"Nityo Infotech is looking for a SOC Analyst.
Salary range: $3500 - $4300 max depending on experienceWorking location: Hampshire Rd, Singapore
Description of Systems to be supported:ArcSight, CyberArk, Imperva and other IT security related systems.
Responsibilities• Provide technical support, advise and implementation to the various phases of development, user acceptance testing, production and disaster recovery, where applicable, for all security systems• Installation and maintenance of the security systems and security compliance.• Interact with clients (internal or external) to understand and meet requirements for the delivery of services related to security products.• Prepare weekly and monthly operational, availability and SLA reports.• Coordinate with vendors for hardware break fix and project activities.• Prepare for new or changed services, management of the change process, management ofperformances of systems and services in relation to their contribution to business performance.• Support the operation and maintenance of vendor products, services and solution. Perform sizing, troubleshooting services and manage critical client situations related to security Systems.• Support power shut down / start up activities for Security Systems.
Duties:1. Monthly log extraction2. Audit trail review3. Advisory alerts4. McAfee Definition update/Hash update5. Email reporting6. Imperva Daily Healthcheck",25-Sep-2023,ArcSight:Imperva:McAfee:Security Compliance:Security Operations:Security Operations Center:Security Systems:Service-Level Agreements (SLA):Troubleshooting:User Acceptance Testing
